,title,rating,genres,votes,synopsis,mainLead1,mainLead2,startYear,endYear,writer,director,id,image_url
901,Live Your Own Life,7.3,"Drama,Family,Romance",96,"Hyo Sim always puts her mother and three brothers' needs and priorities before her own, but change is coming. She starts to live a more peaceful and independent life from her ungrateful and greedy family.",Ahn Hong-jin,Kim You-Jin,2023-01-01,2023-01-01,['Jo Jeong-Seon'],['Kim Hyung-il'],tt29669284,https://m.media-amazon.com/images/M/MV5BY2ZmOGU1OWMtZjkzMy00MzkxLTlmNGMtMzVmMGI3YzZmODJhXkEyXkFqcGc@
903,Longing for You,4.6,"Crime,Drama,Mystery",9300,A mystery chase drama about detective Oh in the countryside.,Na In-woo,Kim Ji-eun,2023-01-01,2023-01-01,['\\N'],['\\N'],tt28198311,https://m.media-amazon.com/images/M/MV5BZDY3ZDNlNmEtYTc4OC00N2JlLTkzYjUtZjdlOTU3MjE5NmJjXkEyXkFqcGc@
904,Maestra: Strings of Truth,7.2,"Drama,Fantasy,Music",287,"Cha Se-Eum, an ex-violinist turned conductor, harbours a dangerous secret. Meanwhile, mysterious cases take place within her orchestra. Adapted from a French work of the same name.",Lee Yeong-ae,Kim Young-ah,2023-01-01,2023-01-01,['Choi Iyun'],"['Su Hyun Lee', 'Jeong-kwon Kim']",tt27817709,https://m.media-amazon.com/images/M/MV5BNTA3MjUyOGMtY2IzOS00ZmMzLTliZTQtMTZhYjEyZWQ1NTA5XkEyXkFqcGc@
910,Metal Cardbot,7.8,"Action,Adventure,Animation",40,"After an explosion forces robot vehicles called Cardbots to Earth, they disguise themselves as regular vehicles. A young BMX rider befriends them and finds a device to power them up.",Jang Ye Na,Kim Eun-ah,2023-01-01,2023-01-01,['\\N'],['\\N'],tt32245465,https://m.media-amazon.com/images/M/MV5BN2E3ZjY2MzctY2Y4OS00YWYzLWExNjgtNmZkMDBhMTI2YzMyXkEyXkFqcGc@
913,Woori the Virgin,5.3,"Comedy,Romance",397,"Oh Woori, an assistant writer, faces a mix-up leading to her accidental insemination by Raphael, CEO of Diamond Cosmetics, amid his messy divorce. Their shared past complicates things further.",Sung Hoon,Im Soo-hyang,2022-01-01,2022-01-01,['Ah Mi Jang'],['Jung-hwa Chung'],tt20227130,https://m.media-amazon.com/images/M/MV5BNDk0MjMzZjktNzllZC00NjE2LWI1N2UtYTRlMWJjN2UxNDhlXkEyXkFqcGc@
918,My Merry Marriage,7.8,"Drama,Family,Romance",35,"Maeng Gong-Hee is a designer at J-Fashion. Her wealthy childhood friend, Gu Dan-Soo, returns to Korea and is now her neighbor. He faced hardships after his mother left him as a child. Can the two of them reconnect and find happiness?",Park Tam-hee,Yang Hee-kyung,2024-01-01,2024-01-01,['Jung-Rim Song'],['Sung Geun Kim'],tt33746553,https://m.media-amazon.com/images/M/MV5BM2M3NDc3MmItMDY0Zi00OGYyLWFlZDgtMTYwMDRkNmZlZWFkXkEyXkFqcGc@
927,Heo's Diner,6.4,"Comedy,Drama,Fantasy",142,"A Joseon-era man leaps 400 years to 2024 Seoul, working at a restaurant with those who saved him. As chef, he seeks both culinary excellence and his would-be killer while pursuing his dream of equality.",Xiumin,Chu So-jung,2025-01-01,2025-01-01,['\\N'],['\\N'],tt36302714,https://m.media-amazon.com/images/M/MV5BZmRiODNlMDgtZjcwMy00NGQzLWE3YTgtYTMxZjk4NDA2ZWFiXkEyXkFqcGc@
934,Pale Moon,7.4,"Romance,Thriller",70,"Yoo I-hwa, a housewife, inadvertently encounters money from VIP bank clients during her contract job, spiraling her into an irreversible descent despite her initially content life amidst her husband's indifference.",Kim Seo-hyeong,Yoo Seon,2023-01-01,2023-01-01,['\\N'],['Wonhee Jung'],tt26290010,https://m.media-amazon.com/images/M/MV5BMGRhMjZkYTctMTdjMy00ZTA2LWJiOGQtYTgzMWJjZTdlNTBlXkEyXkFqcGc@
936,Bad Memory Eraser,6.2,Drama,428,"Lee Goon used to be a promising tennis player but he was injured. After that, he lost all his self-esteem, and his life completely changed.",Kim Jae-joong,Jin Se-yeon,2024-01-01,2024-01-01,['\\N'],['\\N'],tt33058721,https://m.media-amazon.com/images/M/MV5BMDNmYjk3NGMtY2MzYi00NWJhLWExYTctOTZiNzdjNTYxNWViXkEyXkFqcGc@
937,Treat Me Carelessly,6.2,"Comedy,Romance",172,"Shin Yoon Bok, a modern-day Confucian scholar, and Kim Hong Do, a woman frustrated with societal disrespect, embark on a journey that intertwines their contrasting lives and challenges traditional norms.",Kim Myung-soo,Lee Yoo-young,2024-01-01,2024-01-01,['\\N'],['\\N'],tt32029324,https://m.media-amazon.com/images/M/MV5BY2JlNGY2NTctMjRiOC00MjZhLThiMTQtMzkyMzllY2YyYTRjXkEyXkFqcGc@
939,Love Class,7.2,Romance,589,"Depicts a youth drama about a first love that is full of excitement through the protagonist, who learns the meaning of family and community.",Lee Kwang-hee,J-Min,2022-01-01,2022-01-01,['\\N'],['\\N'],tt19800744,https://m.media-amazon.com/images/M/MV5BOTIwMWNkMDMtNjg1Ni00OTEyLWIwOTYtMDA0MWE3YTAwZjdhXkEyXkFqcGc@
941,Bossam: Steal the Fate,7.5,"Drama,History,Romance",388,"Bossam was a custom in Joseon period, in which a bachelor, who missed marriage secretly wrapped up a widow in a blanket at night and made her his wife. This custom changes the fate of Ba Woo when he kidnaps a princess by mistake.",Jung Il-woo,Kwon Yuri,2021-01-01,2021-01-01,"['Park Cheol', 'Kim Ji-soo']",['Suk Jang Kwon'],tt13928294,https://m.media-amazon.com/images/M/MV5BN2FjNDg3OTMtM2YxMy00N2RkLWE3NmEtNjIxMWRlNGNlN2ZmXkEyXkFqcGc@
942,Red Balloon,6.2,"Comedy,Drama,Family",108,"The drama tells the story of the relative deprivation we all suffer, the thirst of our stomach aches, and our struggles to soothe our thirsts.",Seo Ji-hye,Hong Soo-hyun,2022-01-01,2022-01-01,['\\N'],['Jin Hyeong-Wook'],tt25830366,https://m.media-amazon.com/images/M/MV5BNDIxZWQ3NzctMjI3MC00YWVkLTkwMTYtYmMyZWJmZDIwMzUyXkEyXkFqcGc@
943,Let Me Be Your Knight,7.2,"Comedy,Drama,Music",299,A tour guide becomes the live-in doctor for the leader of a famous idol band who suffers from sleepwalking.,Jung In-sun,Jung In-sun,2021-01-01,2021-01-01,['Seo-Ha Shin'],['Ji-Sook Ahn'],tt15729630,https://m.media-amazon.com/images/M/MV5BMTRjY2FmOGEtYTk5OC00MjdjLTlmNDMtOTdkZTMwNmIzMGY1XkEyXkFqcGc@
953,Desperate Mrs. Seonju,7.5,"Comedy,Drama,Family",27,"Desperate Mrs. Seonju tells the story of Seon-ju, a woman who is desperate to start over after her bad marriage is destroyed.",Shim Yi-yeong,Song Chang-ui,2024-01-01,2024-01-01,['\\N'],['Kim Heung Dong'],tt34677309,https://m.media-amazon.com/images/M/MV5BNjczZGViN2QtZjVhZi00MDBiLWIxMTQtYzMyZmRkMmE1NzAyXkEyXkFqcGc@
957,Doksuri 5hyeongjereul Butakhae,5.7,"Comedy,Drama,Romance",686,Five brothers and a sister-in-law who suddenly became the head of the family after her husband's unexpected death.,Uhm Ji-won,Ahn Jae-wook,2025-01-01,2025-01-01,['Goo Hyun-sook'],['Choi Sang-Yeol'],tt35615482,https://m.media-amazon.com/images/M/MV5BOGEzMWU2NDgtOTk4Ny00ZWRiLTkzZmUtOWZmMmZmMjE3ODVlXkEyXkFqcGc@
958,"The King of Tears, Lee Bang-won",4.6,"Drama,History",205,"Set in medieval Korea, Yi Bang-won's rise to power as he navigates political turmoil during the fall of Goryeo and the birth of Joseon. His leadership shapes a new era in Korean history.",Joo Sang-uk,Ye Ji-won,2021-01-01,2021-01-01,['\\N'],['\\N'],tt16549178,https://m.media-amazon.com/images/M/MV5BMzc5YTVkYjgtZmEwNC00NGZlLTlhMTktMTg4ODU3NjUyYjZmXkEyXkFqcGc@
961,Joseon Exorcist,6.7,"Action,Fantasy,History",156,"The series follows the story of King Taejong and his two sons, Prince Chungnyung and Prince Yangnyeong, how they fight the evil spirits who came alive and must be exorcised to save Joseon.",Kam Woo-seong,Jang Dong-yoon,2021-01-01,2021-01-01,['Park Gye-ok'],['Kyungsoo Shin'],tt13634332,https://m.media-amazon.com/images/M/MV5BNjZjNGI1OTYtOTNkNS00NjU3LWIyZGYtNzIwMzI1YzJmNTczXkEyXkFqcGc@
965,Good Job,6.8,"Comedy,Romance",468,Follows the joint investigation and romance story of a chaebol who leads a second life as a detective and a woman with super vision.,Jung Il-woo,Kwon Yuri,2022-01-01,2022-01-01,['\\N'],['Kang Min-Gu'],tt22247864,https://m.media-amazon.com/images/M/MV5BYWFkYjY4M2MtYmE1MS00NGNkLWFkOWMtYmM5ZTc3OGNiOWNkXkEyXkFqcGc@
969,Delivery Man,7.0,"Comedy,Fantasy,Romance",466,The story of a taxi driver who grants the last wishes of ghosts.,Yoon Chan-young,Bang Minah,2023-01-01,2023-01-01,['\\N'],"['Park Dae-hee', 'Kang Sol']",tt26085020,https://m.media-amazon.com/images/M/MV5BNDkzZjQ1MDktODkxNi00MjhjLTg0YjYtNzYyZWM2OWQxODVjXkEyXkFqcGc@
976,Jinxed at First,6.3,"Comedy,Fantasy,Mystery",484,"Seven years ago, Soo Gwang had a completely normal and happy life, but that changed when he met Seul Bi, a woman who, despite their brief encounter, changed his life forever.",Seohyun,Na In-woo,2022-01-01,2022-01-01,['\\N'],['Yoon Sang-ho'],tt21081006,https://m.media-amazon.com/images/M/MV5BNzE0MWMxZWYtNWQ1ZS00OTViLWJjNGUtY2U4MjUyY2NmNTk3XkEyXkFqcGc@
980,Oh My Ladylord,6.0,"Comedy,Drama,Romance",436,"A romantic comedy about a thriller dramas screenwriter and an actress that specializes in romantic comedy. While the writer chooses not to date, the actress cannot seem to date.",Lee Min-ki,Im Jin-ah,2021-01-01,2021-01-01,['Jin-kook Cho'],['Oh Da-Yeong'],tt13715346,https://m.media-amazon.com/images/M/MV5BNDkwMTljNGYtNzg2NS00ZGM5LWIxMzItOTYxM2RjYzA5MDk4XkEyXkFqcGc@
983,Bokjeingan,7.5,Mystery,26,A man who digs into his mother's mysterious death meeting humans with the same faces as him one by one and becoming embroiled in a bigger conspiracy.,Park Hae-jin,Park Hae-jin,2021-01-01,2021-01-01,['\\N'],['Jang Tae Yoo'],tt28790069,https://m.media-amazon.com/images/M/MV5BOGI4NmU2ZWUtNzI3MC00NzU0LTg0NGUtNWFjZDc0ODFiZDAwXkEyXkFqcGc@
984,Baradeon Bada,7.9,"Music,Reality-TV",199,"The cast members open a bar on the sea side and offer to the customers various food, drinks and musical acts so they can escape their daily lives for a moment.",Yoon Jong-shin,Lee Ji-ah,2021-01-01,2021-01-01,['\\N'],['\\N'],tt15307038,https://m.media-amazon.com/images/M/MV5BNTQwZWZjYzUtZTRjNi00ODkyLWIzMmYtZWE1N2EyNzJiNWYzXkEyXkFqcGc@
993,The Empire,7.2,Crime,41,The series looks at the personal life and scandals of a family who have acquired great wealth through their prestigious law firm.,Ahn Jae-wook,Im She-mi,2022-01-01,2022-01-01,"['Oh Ga Kyu', 'Oh Ga-gyu']","['Hyun Ki Yoo', 'Yoo Hyeon-gi']",tt22078980,https://m.media-amazon.com/images/M/MV5BYTA2ZGRkOGItYWRlZS00MzhiLTk0N2UtMWIyMWMzNjM0OWMxXkEyXkFqcGc@
1002,Shasha and Milo,8.1,"Action,Animation,Comedy",68,"Shasha and Milo are the newly activated Crescent Island Guardians. Imbued with the power to transform between human, cat and a formidable hybrid form, Shasha and Milo are tasked with protecting Crescent Island from the dark forces.",Lola Wayne,Rebecca Hanssen,2023-01-01,2023-01-01,"['Andrew Burrell', 'Alex Collier', 'Tony Cooke', 'Rebecca Hobbs', 'Mariama Ives-Moiba', ""Maria O'Loughlin"", 'Jessica Ransom', 'Howard Read', 'Dilpreet Kaur Walia', 'Tobi Wilson', 'Kristina Yee']","['Hyun Min Kim', 'Seul Gee Yoo']",tt27179112,https://m.media-amazon.com/images/M/MV5BYjUzNWZjOWUtMGI3ZS00YjEzLTlkZjktMzE0ZGRmMDU1NWRjXkEyXkFqcGc@
1003,Vengeance of the bride,8.0,Thriller,27,The story of a woman who became the daughter-in-law of an enemy for desperate revenge.,Park Ha-na,Park Ha-na,2022-01-01,2022-01-01,['\\N'],['\\N'],tt30175659,https://m.media-amazon.com/images/M/MV5BZDllMzZiM2MtY2JiMy00Y2VjLTk0OGMtMjY3MzVhMzg1MTIzXkEyXkFqcGc@
1004,Juvenile Delinquency,7.2,"Drama,Romance",148,"Teen Da Jung finds marijuana fields and yearns for normalcy with friends. After being exploited by parents for drug running, she encounters Yoon Tak and his friends in rural Korea.",Won Ji-an,Won Ji-an,2022-01-01,2022-01-01,['\\N'],['\\N'],tt19512372,https://m.media-amazon.com/images/M/MV5BZmY2OGU3YjItYzRlNC00MzVhLTg1NmEtOTEwYTNhM2YxZjk1XkEyXkFqcGc@
1008,Show Window: The Queen's House,7.0,"Drama,Mystery,Romance",116,"A mystery melodrama about a woman named Han Sun Joo who expresses support for another woman's involvement in an affair, without knowing that the affair is with her husband.",Song Yun-ah,Lee Sung-jae,2021-01-01,2021-01-01,"['Han Bo Gyeong', 'Park Hye-Young']","['Park Dae-hee', 'Kang Sol']",tt15809802,https://m.media-amazon.com/images/M/MV5BZmMxZjQ2YzItNmUwMy00N2MxLWIyY2ItYzM5ZGJjOTg1ODU5XkEyXkFqcGc@
1012,Girl's High School Mystery Class,8.3,Game-Show,67,A mystery adventure series that features the mystery team's task to uncover suspicious events and secrets in a girls' high school.,Bibi,Park Ji-yoon,2021-01-01,2021-01-01,['\\N'],['Jung Jong-Yeon'],tt13974440,https://m.media-amazon.com/images/M/MV5BZTAzNzUzMTAtNTNkMS00ZjVhLWE1NjYtNmQ5ZmYzYzk1ODA1XkEyXkFqcGc@
1014,Green Mothers Club,7.0,"Drama,Mystery",433,"The friendship, motherhood, and growth of five mothers. Each of them have their own issues that they could not overcome. They who had come to think of themselves only as ""mother,"" will reveal hidden secrets. After they meet in the elementary school community, they learn to heal and grow by interacting and comforting each other.",Lee Yo-won,Chu Ja-hyeon,2022-01-01,2022-01-01,['Shin Yi-won'],['La Ha-na'],tt15060900,https://m.media-amazon.com/images/M/MV5BNmUwNTFiYmMtNjdmYS00NTQzLTlhNjItZDI4NjE5M2U1ZjY3XkEyXkFqcGc@
1016,A Nation of Broth,7.7,Documentary,103,"A documentary series about the importance of broth in Korean cuisine. A warm bowl of broth is essential after a long day to Koreans, as a meal without broth is unimaginable.",Ryu Soo-young,Huh Young-Man,2022-01-01,2022-01-01,['\\N'],['\\N'],tt21443848,https://m.media-amazon.com/images/M/MV5BNWE4NzJhMDMtMTVmNi00OTIyLWFkODItZTdiMDc1MTA4MGY3XkEyXkFqcGc@
1040,New World,7.8,Reality-TV,586,"In this reality show, six celebs strategize and sabotage to earn virtual currency they can cash in on the final day of their stay on a utopian island.",Kim Heechul,Eun Ji-won,2021-01-01,2021-01-01,"['Hyo Jin Cho', 'Min-Seok Go']",['\\N'],tt15496866,https://m.media-amazon.com/images/M/MV5BZjk1NzlhMjEtNjMxOC00NWI3LWI3OGMtNjkyYjY0OWE4ZTdkXkEyXkFqcGc@
1044,FC Soldout,6.5,"Drama,Sport",189,"FC Soldout, a failing soccer team, is bought by an agency aiming to profit by commoditizing it. They replace unattractive players with high face-value actors from their agency, forcing them into the team.",Jong Hoon Park,Deok Won Ko,2025-01-01,2025-01-01,['\\N'],['\\N'],tt35510253,https://m.media-amazon.com/images/M/MV5BOWE0MGZhODQtZjc0MC00NWQzLTkxMWMtZWM0ZTVhYTI3MDJiXkEyXkFqcGc@
1046,My Sibling's Romance,8.2,"Reality-TV,Romance",94,"Dating show with a family twist. Five pairs of biological brothers and sisters, share a house to assist each other in finding love. No one can reveal who their sibling is. Through dates and texts, romantic feelings will be revealed.",Cho Miyeon,Hyejin Han,2024-01-01,2024-01-01,['\\N'],['Lee Jin-joo'],tt31867638,https://m.media-amazon.com/images/M/MV5BNzE5NWE3MjEtMDJhNC00NDNlLWFmZmQtNWUxZGIyZWE2ODc0XkEyXkFqcGc@
1047,Kick Kick Kick Kick,6.4,Comedy,30,Establishing and running a new content production company by an entertainment producer and a once-popular actor.,Ji Jin-hee,Lee Kyoo-hyung,2025-01-01,2025-01-01,['\\N'],['\\N'],tt35671313,https://m.media-amazon.com/images/M/MV5BOGRlNTg4ZGQtMWVkZS00MzNmLTgzYmQtMWM3NjFmYmJkYTVmXkEyXkFqcGc@
1053,Dear X Who Doesn't Love Me,6.5,"Drama,Romance",100,"'To X who doesn't love me' is a story of young people in their 20s who are struggling with their dreams and love, heralding the birth of a reality-sympathetic drama. 'To X Who Doesn't Love Me' is a ""expiry date"" romance drama that tells the story of Seo Hee Su, a college student and aspiring lyricist with zero self-esteem and zero self-love, who discovers a mysterious lyric note that makes anyone fall in love with her for a month and gets intertwined with Jung Si Ho.",Han Ji-hyo,Doyoung,2022-01-01,2022-01-01,['\\N'],['Jae Hong Ko'],tt21054064,https://m.media-amazon.com/images/M/MV5BZTJlM2Q5YWUtYjBhZi00YzJmLWJmZTgtNzNkNTAwM2U1MzgyXkEyXkFqcGc@
1068,DNA Lover,5.9,"Comedy,Romance",232,"A romantic comedy in which Han So-jin, a genetic researcher who has failed countless relationships, finds a mate of his own through genes.",Jung In-sun,Choi Siwon,2024-01-01,2024-01-01,['Jung Soo-Mi'],['Sung Chi-wook'],tt30397416,https://m.media-amazon.com/images/M/MV5BM2M4OWFhOTQtY2VkZC00ODQwLTgzZWYtODIzZGRkZDY3NWY3XkEyXkFqcGc@
1071,Ultimate Weapon Alice,6.8,"Action,Drama,Romance",252,A youth action romance about the bloody high school lives of mysterious transfer student and killer Gyeo Wool and traumatized high school student Yeo Reum as they meet and get chased down by a criminal organization.,Cha Joo-young,Kim Tae-hoon,2022-01-01,2022-01-01,['Lee Byeong-heon'],['Lee Byeong-heon'],tt21031538,https://m.media-amazon.com/images/M/MV5BYjUzNjkyYjgtOGEyMi00YTJiLWFlM2UtM2U0YTA1MTA4MzgyXkEyXkFqcGc@
1075,Uncle,8.0,"Comedy,Drama,Family",160,A music drama about an unemployed uncle and his 12-year-old nephew.,Oh Jung-se,Jeon Hye-jin,2021-01-01,2021-01-01,"['Park Ji-sook', 'Oliver Refson']",['Ji Yeong-Su'],tt14683804,https://m.media-amazon.com/images/M/MV5BZWIwNzlkMzgtZjJhNS00MWQyLWJhNzgtZGJlOTNjZjUyNTE3XkEyXkFqcGc@
1083,Crime Puzzle,6.7,"Drama,Mystery,Romance",142,"A criminal psychologist, sent to prison for murdering a political candidate, and the criminal profiler, who lost his father to a murder, conduct interviews about killings that happened in prison.",Yoon Kyesang,Ko Ah-sung,2021-01-01,2021-01-01,"['Choi Jong-Gil', 'Meen', 'Misang']",['Kim Sang Hoon'],tt15305982,https://m.media-amazon.com/images/M/MV5BMzY2ZGI2MDQtZjc2Yi00ZWE0LWFhNjItZmFkMjUxZGVjNmEwXkEyXkFqcGc@
1089,Meant to Be,7.1,"Drama,Family",11,A tragic story of a father and daughter begins when his greed turns them into sworn enemies.,Kim Yu-seok,Jeon Hye-Yeon,2023-01-01,2023-01-01,['\\N'],['\\N'],tt29442649,https://m.media-amazon.com/images/M/MV5BNWI0ZTc3MmQtMzRlYS00MGZiLWI2ZGItM2YwZDdhYjE1ZDYzXkEyXkFqcGc@
1095,My Lovely Boxer,7.2,"Drama,Romance,Sport",291,"A drama about a genius boxer Lee Kwon-sook who meets sports agent Kim Tae-yeong ahead of the Grand Slam, and faces an inflection point in her life.",Lee Sang-Yeob,Park Ji-hwan,2023-01-01,2023-01-01,['\\N'],"['Choi Sang-Yeol', 'Eun-mi Hong']",tt27440576,https://m.media-amazon.com/images/M/MV5BOTkxOGE4YjYtZmUxYS00NDg0LTk4NjQtNWE3OTk2ODkyMTA0XkEyXkFqcGc@
1107,His Man,8.0,Reality-TV,133,"As South Korea's very first gay dating reality series, His Man brings together a group of eight hot, sexy, free and single gay men to a shared house where they are to live, interact and open up to each other in their quest for ""true love.""",Chan-Kyu Kim,Kim Hyeon,2022-01-01,2022-01-01,['\\N'],['\\N'],tt25816266,https://m.media-amazon.com/images/M/MV5BZGJlN2NiYzUtMGNmMS00NDYzLWI0NTEtNWFjMTQ2MzVjZDQ4XkEyXkFqcGc@
1109,Decoy,6.7,"Action,Drama",222,"Former lawyer Ku Do Han investigates unsolved crimes, piecing together clues from current cases. He's joined by reporter Cheon Na Yeon and con artist No Sang Cheon as they unravel the truth and seek justice.",Jang Keun-suk,Heo Sung-tae,2023-01-01,2023-01-01,['\\N'],['Kim Hong-sun'],tt26468611,https://m.media-amazon.com/images/M/MV5BZjMzZTM1NmQtM2ZhOS00Mjk0LTk2YTUtNzgyN2Y5MmY0ZmQ5XkEyXkFqcGc@
1116,Fly High Butterfly,8.3,Drama,79,A story about people working in a hair salon.,Kim Hyang-gi,Choi Daniel,2022-01-01,2022-01-01,['Yeon-seon Park'],"['Kim Bo-Kyung', 'Kim Da-Ye']",tt14169862,https://m.media-amazon.com/images/M/MV5BZTNlMGNiYWYtMDk4MC00NmY0LWFhZGItMGNlMWMzODZjZjEwXkEyXkFqcGc@
1126,Love in Spring,7.0,"Drama,Romance",71,"Jin Geum Seong is a poor nobleman who lives with his mother and making ends meet is challenging. While gathering wood on the mountain, he spies a woman swimming nearby. Believing she is about to take her life, he creates a disturbance allowing him to save Choi Hye Seong, the third daughter of Choi Jin Sa. Only things are not as they seem when she turns out to be a man named 'Salbyul,' Love will bloom between Hye Seong and Geum Seong, much like a flower on a warm spring day.",Yoo Young-jae,Kim Hee-seon,2022-01-01,2022-01-01,['Chang-han Lee'],['Chang-han Lee'],tt20319230,https://m.media-amazon.com/images/M/MV5BNmVjZmNkOTktZTZjOS00MTBlLTgzMGQtODk2NGNmODJmZWQyXkEyXkFqcGc@
1130,Excellent Shaman Ga Doo Shim,6.9,"Fantasy,Mystery",510,A story of a high school girl born with an undesired fate who transfers to a haunted school where a student who came last on the test commits suicide.,Kim Sae-ron,Nam Da-reum,2021-01-01,2021-01-01,['Joo Brothers'],['Park Ho-Jin'],tt15021430,https://m.media-amazon.com/images/M/MV5BYzc5MjJiYzktZTM2OS00MTVjLTg5NjUtODZjMDJkYWQ0Nzk3XkEyXkFqcGc@
1139,The Queen Who Crowns: Before Sunrise,8.1,"Drama,History,Romance",41,"Prequel of the The Queen Who Crowns (2025). The fateful first meeting between Wongyeong, who had dreams of a new world before she had a child, and Bang-won, who had the same feelings.",Cha Joo-young,Lee Hyun-wook,2025-01-01,2025-01-01,['Lee Young-mi'],['Kim Sang-ho'],tt35567462,https://m.media-amazon.com/images/M/MV5BNzA0ZWMyNjQtZmVhNy00OWY3LThmNmUtOWY0ZmY1OGFmN2E0XkEyXkFqcGc@
1145,Times,6.9,"Crime,Drama,Fantasy",162,"A ""time warping"" political mystery drama that tells the story of Seo Jeong In, who becomes connected to reporter Lee Jin Woo from five years in the past through a phone call.",Lee Seo-jin,Lee Joo-young,2021-01-01,2021-01-01,"['Ahn Hye-Jin', 'Lee Sae-Bom']",['Yoon Jong-ho'],tt13800344,https://m.media-amazon.com/images/M/MV5BZDM2YTY4NzUtNDcyNS00YWQ3LTg1ZTItMWIyZmNmNTcxNjU5XkEyXkFqcGc@
1161,RACE,6.3,"Comedy,Drama,Romance",223,"Office politics take center stage for marketer Park Yoon Jo, whose lack of an academic background won't deter her dedication to her work, and the smart and just Ryu Jae Min, who lacks any expectations towards their company.",Lee Yeon-hee,Hong Jong-hyun,2023-01-01,2023-01-01,['\\N'],"['Claire Dodin', 'Valeria Zunzun', 'Lee Dong-yoon']",tt27476655,https://m.media-amazon.com/images/M/MV5BYTg2MzE5ZjAtYzcxMi00NGFjLWFiZWUtN2UzOTM0MTQxNjU5XkEyXkFqcGc@
1175,Welcome to Wedding Hell,6.0,"Drama,Romance",341,"A marriage proposal is supposed to be a happy ending. But for one couple, it becomes the beginning of an uphill struggle over wedding preparations.",Lee Yeon-hee,Lee Jin-wook,2022-01-01,2022-01-01,['Choi I-rang'],['Seo Joo-Wan'],tt20192096,https://m.media-amazon.com/images/M/MV5BNTAzNTY0ZmQtOWZkNC00NjZjLWEwZGEtYTNlMzkwOTg5ZjczXkEyXkFqcGc@
1177,Stock Struck,6.9,Comedy,51,An entertaining story about a diverse group that comes together to learn about stocks. They help each other navigate the ups and downs of the stock market and their personal lives.,Kim Sun-young,Han Ji-Eun,2022-01-01,2022-01-01,['\\N'],['Ji Yeong Choi'],tt23031776,https://m.media-amazon.com/images/M/MV5BY2I0OTA3OTktNDY5MS00NWY5LWI4NjMtNjMxYzdiN2EyZWY2XkEyXkFqcGc@
1191,Second Husband,7.6,"Crime,Drama,Family",52,"Bong Seon Hwa overcomes childhood adversity through resilience, rising in her family's confectionery business. Her lifelong bond with Moon Sang Hyuk faces tragedy when desire costs her family. She vows revenge after an unjust loss.",Uhm Hyun-kyung,Uhm Hyun-kyung,2021-01-01,2021-01-01,['\\N'],['\\N'],tt21109624,https://m.media-amazon.com/images/M/MV5BN2M0MTk4NzAtOWM3Mi00MTNhLWI0ODUtNTkyMGEyOTExYzY2XkEyXkFqcGc@
1200,Emotia,8.8,"Adventure,Animation,Fantasy",19,"Pepper, a teen gamer, meets Glee Heart, a princess from the emotion-powered world of Emotia. Together, they embark on the adventure of battling Phone Head, a corrupted human spreading addictive content.",Paul Castro Jr.,Paul Castro Jr.,2025-01-01,2025-01-01,['Andaram'],"[""GH'S""]",tt35668886,https://m.media-amazon.com/images/M/MV5BNzYxMjdkNGYtMzlhNC00NTVhLTg0NDQtMmVhMTc0NWI2ZmVmXkEyXkFqcGc@
1208,Sabotage City,5.8,"Drama,Mystery,Thriller",119,A psychological mystery thriller that tells the story of things which lose their meaning when greed and power comes into play.,Soo Ae,Kim Kang-woo,2021-01-01,2021-01-01,['Son Se-Dong'],"['Jeon Chang-Geun', 'Chang Geun Jun']",tt14482486,https://m.media-amazon.com/images/M/MV5BZWIxOTc0N2MtNzcyZC00ODU0LTk1NzAtYjdhMjY2NDAyZTE3XkEyXkFqcGc@
1209,Bite Sisters,6.3,"Fantasy,Romance",114,Han Yi Na a vampire who suddenly becomes an online influencer. She uses her newfound fame to help those others.,Kang Han-na,Kim Yeong-Ah,2021-01-01,2021-01-01,['Ka-ram Han'],['Ka-ram Han'],tt16354496,https://m.media-amazon.com/images/M/MV5BODNjNmY0ZjItOTQwMi00OTljLWJmOWQtMTZiMTU2YzA4Yzg4XkEyXkFqcGc@
1215,Villains Everywhere,7.8,Comedy,43,"Two competitive families, two matriarchal wife's, O Na Ra and her frienemy sister O Yu Jin, two dumb husbands who their wife's don't hear what they say, children who don't hear what they parents say. A day to day caos sitcom comedy.",Oh Na-ra,So Yoo-jin,2025-01-01,2025-01-01,['\\N'],['\\N'],tt36256053,https://m.media-amazon.com/images/M/MV5BYzI5YmMxYjEtOTkwNS00ZGRlLWI0ZWQtNTcwMTliZjkxODlhXkEyXkFqcGc@
1218,Namgogoedam,6.8,"Mystery,Thriller",169,"A late-night sance reveals the presence of a ghost haunting a class of 12th grade students in an all-boys school, impelling them to suspect each other.",Haruto,Kim Do-young,2021-01-01,2021-01-01,['Song-yi Han'],['Ha Han Me'],tt20426062,https://m.media-amazon.com/images/M/MV5BN2M1YzVlMmMtYWVlYi00ZTExLTk0MWEtYmU4ODI4NWNhYmVjXkEyXkFqcGc@
1225,Keullining eop,7.1,"Comedy,Crime,Drama",138,Tells the story about the struggle cleaners at a security firm have as they try to create a new destiny for themselves after overhearing about insider trading.,Yum Jung-ah,Jun So-min,2022-01-01,2022-01-01,['\\N'],['Yoon Sung-shik'],tt20833440,https://m.media-amazon.com/images/M/MV5BYmQ0NTI5NzQtMmI1OC00ZGM5LThhODgtNDczNjE5OGM3MjlkXkEyXkFqcGc@
1233,Dog Knows Everything,8.1,"Comedy,Drama,Fantasy",72,An aging actor hears the voice of a dog and solves a mysterious case.,Lee Soon-jae,Kim Yong-geon,2024-01-01,2024-01-01,['\\N'],['Kim Yoo-Jin'],tt33292030,https://m.media-amazon.com/images/M/MV5BMzI1ZTYxMTQtZjQyYy00MjQ0LWFjMDMtNDEwMjk5Y2ZhMDQwXkEyXkFqcGc@
1244,K Food Show: A Nation of Kimchi,7.6,Documentary,67,,Mimi,Ryu Soo-young,2023-01-01,2023-01-01,['\\N'],['\\N'],tt29521736,https://m.media-amazon.com/images/M/MV5BNjcwZWU1ZmYtODE1Ny00MTA2LWEwZTctOWFiZGZhMDVkZjJiXkEyXkFqcGc@
