,title,rating,genres,votes,synopsis,mainLead1,mainLead2,startYear,endYear,writer,director,id,image_url
0,"Genie, Make a Wish",6.4,"Comedy,Fantasy,Romance",7700,"Jinn, a genie who awakens after a thousand years, and Ka-young, his new impassive master.",Kim Woo-bin,Bae Suzy,2025-01-01,2025-01-01,['Kim Eun-sook'],['Lee Byeong-heon'],tt32409807,https://m.media-amazon.com/images/M/MV5BOWM4MjQ1M2EtODY4OS00NGQwLTgxYWYtOTA2ODM3MGU0MTgzXkEyXkFqcGc@
1,Squid Game,8.0,"Action,Drama,Mystery",723000,"Hundreds of cash-strapped players accept a strange invitation to compete in children's games. A tempting prize awaits, but with deadly high stakes.",Lee Jung-jae,Greg Chun,2021-01-01,2021-01-01,['Hwang Dong-hyuk'],['Hwang Dong-hyuk'],tt10919420,https://m.media-amazon.com/images/M/MV5BYTU3ZDVhNmMtMDVlNC00MDc0LTgwNDMtYWE5MTI2ZGI4YWIwXkEyXkFqcGc@
2,When Life Gives You Tangerines,9.1,"Drama,History,Romance",29000,"In Jeju, a spirited girl and a steadfast boy's island story blossoms into a lifelong tale of setbacks and triumphs, proving love endures across time.",IU,IU,2025-01-01,2025-01-01,"['Im Sang-choon', 'Lim Sang-Chung', 'Kim Won-seok']",['Kim Won-seok'],tt26471411,https://m.media-amazon.com/images/M/MV5BZTBhZTcwNWUtOTZjMi00ZjI2LWEzMzMtNWJkMWQ2ZDA0NTU3XkEyXkFqcGc@
3,Typhoon Family,8.1,Drama,296,"CEO Kang Tae Pung runs Typhoon Company, his family business. His father cherished it like family. Since inheriting it after his father's death, he's fought to save it, especially during the 1997 IMF crisis.",Lee Jun-ho,Minha Kim,2025-01-01,2025-01-01,['\\N'],['Lee Na-jeong'],tt36856846,https://m.media-amazon.com/images/M/MV5BYzhkZTI0MzctYzZkYS00YzU5LTlhZTEtOWE1NmIyZTAwZGU5XkEyXkFqcGc@
5,All of Us Are Dead,7.6,"Action,Drama,Fantasy",85000,A high school becomes ground zero for a zombie virus outbreak. Trapped students must fight their way out or turn into one of the rabid infected.,Park Ji-hu,Yoon Chan-young,2022-01-01,2022-01-01,"['Seong-il Cheon', 'Joo Dong-Geun']","['J.Q. Lee', 'Kim Nam-Soo']",tt14169960,https://m.media-amazon.com/images/M/MV5BZDY4ZmZhNzMtNjdkMC00NTE3LWFjYzQtOGE4OTllOGY1NTk5XkEyXkFqcGc@
6,Tempest,6.7,"Action,Drama",9600,"Munju, an ex-ambassador, and Sanho, a secret agent, investigate an attack that could destabilize the Korean peninsula, unraveling a dangerous conspiracy that jeopardizes regional peace and security.",Christopher Gorham,Brooke Smith,2025-01-01,2025-01-01,"['Park Chan-wook', 'Chung Seo-kyung']","['Kim Hee-won', 'Heewon Kim', 'Heo Myung-Haeng']",tt27368147,https://m.media-amazon.com/images/M/MV5BNGFmYTNkNmUtZmQzMi00ZjkxLWI0NDgtY2ZmZDJiMmEyMDc1XkEyXkFqcGc@
7,Alchemy of Souls,8.7,"Action,Drama,Fantasy",26000,"Set in a fictional country called Daeho, it is about the love and growth of young mages as they overcome their twisted fates due to a forbidden magic spell known as the ""alchemy of souls"", which allows souls to switch bodies.",Lee Jae-wook,Hwang Min-hyun,2022-01-01,2022-01-01,"['Hong Jeong-eun', 'Hong Mi-ran']",['Park Joon-hwa'],tt20859920,https://m.media-amazon.com/images/M/MV5BOGFhNGQzMWUtZWJhNi00NGZiLTg1MjEtMTQzZmU4Njg2MWRhXkEyXkFqcGc@
10,Pachinko,8.4,Drama,17000,"Based on the New York Times bestseller, this sweeping saga chronicles the hopes and dreams of a Korean immigrant family across four generations as they leave their homeland in an indomitable quest to survive and thrive.",Lee Min-ho,Jin Ha,2022-01-01,2022-01-01,"['Soo Hugh', 'Min Jin Lee', 'E.J. Koh', 'Franklin jin Rho', 'Mfoniso Udofia', 'Lauren Yee', 'Karen Chee', 'Haruna Lee', 'Ethan Kuperberg', 'Chang-rae Lee', 'Melissa Park', 'Hansol Jung', 'Matthew J. McCue', 'David Mitchell', 'Christina Yoon']","['Justin Chon', 'Kogonada', 'Arvin Chen', 'Sang-il Lee', 'Leanne Welham']",tt8888462,https://m.media-amazon.com/images/M/MV5BN2QwMTgyZTAtOTM4MS00OGRhLWIzNjQtZmQ3Yzc5NmNiYzhlXkEyXkFqcGc@
11,Trigger,7.2,"Action,Crime,Thriller",4200,"About two men who are trying to solve a mess after firearms are suddenly widely available in South Korea, which used to be a gun-free country, through an unknown source.",Kim Nam-gil,Kim Young-kwang,2025-01-01,2025-01-01,['Oh-Seung Kwon'],['Oh-Seung Kwon'],tt27898511,https://m.media-amazon.com/images/M/MV5BMTM3MWRiYWMtZmVkMi00OWE0LWI1M2ItMzE2ODc3YWM3YTU4XkEyXkFqcGc@
13,The Glory,8.2,"Drama,Mystery,Thriller",40000,A woman lives for absolute revenge against her childhood bullies who destroyed her life.,Song Hye-kyo,Lee Do-hyun,2022-01-01,2022-01-01,['Kim Eun-sook'],['Ahn Gil-ho'],tt21344706,https://m.media-amazon.com/images/M/MV5BODM0ZTc5YTAtZmMxNi00YzJkLWEzODItZDczZTRlNTc1NGE3XkEyXkFqcGc@
15,Bloodhounds,8.1,"Action,Crime,Drama",21000,"In order to pay off their debt, three daring youths jump into the money-lending business while confronting the rich and powerful who prey on the weak.",Lee Sang-yi,Woo Do-Hwan,2023-01-01,2023-01-01,"['Jeong Chan', 'Joo-hwan Kim']",['Joo-hwan Kim'],tt26315487,https://m.media-amazon.com/images/M/MV5BODc1ODMyNDMtOTU2Yi00NmMyLWJhYzQtODUzMDJkNGVhZDY4XkEyXkFqcGc@
16,Business Proposal,8.1,"Comedy,Drama,Romance",38000,"In disguise as her friend, Ha-ri shows up to a blind date to scare him away. But plans go awry when he turns out to be her CEO - and makes a proposal.",Ahn Hyo-seop,Kim Sejeong,2022-01-01,2022-01-01,"['Hong Bo-hee', 'Hae Hwa', 'Han Seol-hee']",['Park Seon-ho'],tt14819828,https://m.media-amazon.com/images/M/MV5BYWM2NTM4MTktNDFiNi00NTI3LThiZTgtZmJiZTQ2NzdhNDE3XkEyXkFqcGc@
17,Queen of Tears,8.2,"Comedy,Drama,Romance",24000,A miraculous love story of a married couple overcoming a dizzying crisis.,Kim Soo-hyun,Kim Ji-won,2024-01-01,2024-01-01,['Park Ji-eun'],"['Kim Hee-won', 'Jang Young-woo']",tt27668559,https://m.media-amazon.com/images/M/MV5BNWNmYmQ2NzctNTA1NS00NGU2LThjOTQtYTgxNmUyYmNjODYyXkEyXkFqcGc@
18,Mouse,8.6,"Action,Crime,Mystery",16000,"Jung Ba-Reum is a rookie police officer. He is an honest person and tries to attain justice. After Ba-Reum faces a psychopath murderer, who places the entire nation in fear, his life is totally changed.",Hyun Bong-sik,Jo Jae-yoon,2021-01-01,2021-01-01,['Ran Choi'],"['Joon Bae Choi', 'Cheol Woo Kang']",tt13634792,https://m.media-amazon.com/images/M/MV5BMjJkNzA2N2EtMjAxOC00MTY3LTkxZTEtODQxMTI4YjAyZTk2XkEyXkFqcGc@
19,King the Land,5.7,"Comedy,Drama,Romance",140000,"Amid a tense inheritance fight, a charming heir clashes with his hardworking employee who's known for her irresistible smile, which he cannot stand.",Lee Jun-ho,Im Yoon-ah,2023-01-01,2023-01-01,"['Seong-il Cheon', 'Choi Rom']",['\\N'],tt26693803,https://m.media-amazon.com/images/M/MV5BODM2MGU3OTItNTUyZS00ODc2LWJlNzMtOTI5ZTQ4MjljMzI4XkEyXkFqcGc@
22,Mercy for None,7.5,"Action,Crime,Thriller",7600,"After severing ties with his gang, a former gangster returns to uncover the truth behind his brother's death, embarking on a relentless path of revenge.",So Ji-seob,Huh Joon-ho,2025-01-01,2025-01-01,"['Oh Se Hyung', 'nm17384002', 'Kyun Tae Kim']",['Choi Sung-eun'],tt29650530,https://m.media-amazon.com/images/M/MV5BMmY5MzdmYjEtY2RhMS00ZGNkLTliOGEtY2M4NTBmZmU5NDc1XkEyXkFqcGc@
24,Vincenzo,8.4,"Action,Comedy,Crime",38000,"During a visit to his motherland, a Korean-Italian Mafia lawyer gives an unrivaled conglomerate a taste of its own medicine with a side of justice.",Song Joong-ki,Song Joong-ki,2021-01-01,2021-01-01,['Park Jae-beom'],['Kim Hee-won'],tt13433812,https://m.media-amazon.com/images/M/MV5BNjA1YmJiNTMtMDc4OC00ZjlkLTgyMjctYzRmMWJhMmZhMjkyXkEyXkFqcGc@
26,My Name,7.8,"Action,Crime,Drama",41000,The story about a woman who joins an organized crime ring and infiltrates the police as an undercover agent in order to find out the truth about her father's death.,Han So-hee,Han So-hee,2021-01-01,2021-01-01,['Ba-da Kim'],['Jin-min Kim'],tt12940504,https://m.media-amazon.com/images/M/MV5BN2ZiZWU3MzMtNGM5OC00ZWVkLTkxNjUtMTYwZGU4MzgxYzk0XkEyXkFqcGc@
27,Twinkling Watermelon,8.9,"Comedy,Drama,Fantasy",11000,"""Sparkling Watermelon"" will tell the story of a boy living a double life between a model student and a band member who gets to time slip and meets his 18-year-old father. The two will build friendships there.",Ryeoun,Seol In-ah,2023-01-01,2023-01-01,['Jin Su-wan'],['Son Jung-hyun'],tt27446493,https://m.media-amazon.com/images/M/MV5BZGNhMDc0NTgtODc1MS00ZWU5LTgwMWUtYmYzMDZjNDg5ODk1XkEyXkFqcGc@
28,Good Boy,7.3,"Action,Comedy,Romance",5100,"Olympic medalists join the police force through a special recruitment program, trading medals for badges as they tackle violent crimes and injustices with their athletic skills.",Park Bo-gum,Kim So-hyun,2025-01-01,2025-01-01,['Lee Dae II'],"['Jessica Blue', 'Shim Na-yeon']",tt32361930,https://m.media-amazon.com/images/M/MV5BNjIyMTZkYTItMDMzYy00OTgwLWE1Y2MtNDdlZGZmOTZkMGMzXkEyXkFqcGc@
29,Death's Game,8.5,"Drama,Fantasy",21000,"Facing hardships and contemplating suicide after a series of setbacks, a man is confronted by Death and tasked with experiencing death over and over again through 13 other lives to earn the chance to live.",Seo In-guk,Park So-dam,2023-01-01,2023-01-01,['Lee Wonsik'],['Ha Byung-hoon'],tt26225038,https://m.media-amazon.com/images/M/MV5BNzU1OTc1YzQtMjAxOS00NjhhLTk2ZmQtM2M2YTU4NTZlYjM4XkEyXkFqcGc@
30,Study Group,8.3,"Action,Comedy,Crime",5500,"A struggling student at Korea's worst high school forms a study group while protecting his classmates with his fighting skills, hoping to overcome academic challenges and secure a spot in college.",Hwang Min-hyun,Han Ji-Eun,2025-01-01,2025-01-01,"['Seungyeon Ryu', 'Hyungwuk Shin', 'Oh Bo-hyun', 'Eom Seon-ho']",['Lee Jang-hoon'],tt35304338,https://m.media-amazon.com/images/M/MV5BZDJmMDU0MTEtNmZkOS00ZGViLWExYTctYWY5YWQ0NTZlZTdhXkEyXkFqcGc@
33,Extraordinary Attorney Woo,8.6,Drama,36000,"Follows the brilliant attorney Woo Young-woo, who tackles challenges in and out of the courtroom as a rookie at a prominent law firm and a woman on the autism spectrum.",Park Eun-bin,Kang Tae-oh,2022-01-01,2022-01-01,['Moon Ji-won'],['Yu In-sik'],tt20869502,https://m.media-amazon.com/images/M/MV5BMGM4ZjU4ZWItZWNmYy00ZDZhLThjY2EtMDEyOTk0NjI3YzJiXkEyXkFqcGc@
36,Twenty Five Twenty One,8.6,"Drama,Romance",20000,"In a time when dreams seem out of reach, a teen fencer pursues big ambitions and meets a hardworking young man who seeks to rebuild his life. At 22 and 18, they say each other's names for the first time, at 25 and 21, they fall in love.",Kim Tae-ri,Nam Joo-hyuk,2022-01-01,2022-01-01,['Kwon Do-eun'],"['Jihyeon Jeong', 'Seung Ho Kim']",tt17513352,https://m.media-amazon.com/images/M/MV5BYTdjZWExZmMtZTY0Yy00N2U3LTkyYmYtMGNjZjUyZTM0Njg0XkEyXkFqcGc@
38,Queen Mantis,7.4,"Crime,Thriller",815,"A cop must work with his mother, the ""Mantis"" - a female serial killer who murdered 5 men decades ago - when copycat killings emerge. He's hated her his whole life.",Jang Dong-yoon,Kim Bo-ra,2025-01-01,2025-01-01,['Young-jong Lee'],['Young-Joo Byun'],tt35934396,https://m.media-amazon.com/images/M/MV5BYjdkZjE3ODAtMDMwZS00OTBmLTlkODUtMDhlOTcwNmMzMWQyXkEyXkFqcGc@
39,Nine Puzzles,7.7,"Crime,Drama,Mystery",3500,"Jo I-na finds her uncle murdered beside a puzzle piece but can't explain her presence. Ten years later, as a criminal profiler, she investigates murders where victims are found with similar puzzle pieces.",Kim Da-mi,Son Suk-ku,2025-01-01,2025-01-01,['Lee Eun-Mi'],['Yoon Jong-bin'],tt29927351,https://m.media-amazon.com/images/M/MV5BOGExZDkxYWUtMzM0NS00OTZiLTkzNzctZmQwZTMyODk1NTJmXkEyXkFqcGc@
41,My Demon,7.6,"Comedy,Drama,Fantasy",18000,"A pitiless demon becomes powerless after getting entangled with an icy heiress, who may hold the key to his lost abilities -- and his heart.",Kim Yoo-jung,Song Kang,2023-01-01,2023-01-01,['Choi Ah-Il'],['Kim Jang-Han'],tt29569035,https://m.media-amazon.com/images/M/MV5BNTg5YmU0OTYtNzIzNy00MzM1LWI0OWEtYzc5ZmRlNmJlODk5XkEyXkFqcGc@
43,Big Mouth,7.8,"Action,Crime,Drama",8700,Thriller about an unsuccessful lawyer who gets involved in a murder case and is somehow fingered as genius swindler Big Mouse.,Lee Jong-suk,Im Yoon-ah,2022-01-01,2022-01-01,"['Young Chul Jang', 'Kyung Soon Jung']",['Choong Hwan Oh'],tt21195490,https://m.media-amazon.com/images/M/MV5BNWNhNWEzNjMtMDhjMi00MmZlLWIzMjAtNjA1OGRiYjIzOWUxXkEyXkFqcGc@
44,Lovely Runner,8.5,"Comedy,Fantasy,Music",13000,"Right after top star Ryoo Seon-jae ends his life, his top fan Im Sol somehow time-travels back to when they were in high school and tries to protect him. A fantasy romance unfolds where people who missed each other in time finally meet.",Byeon Woo-seok,Byeon Woo-seok,2024-01-01,2024-01-01,"['Kim Bbang', 'Lee Shi-Eun']","['Boo Sung-chul', 'Kim Tae-Yeong', 'Yoon Jong-ho', 'Kim Tae Yeop']",tt31324295,https://m.media-amazon.com/images/M/MV5BNjYwM2RkMmUtOGU2OS00ZjdlLWE5Y2UtYzRkMzExYjdhNjVlXkEyXkFqcGc@
47,Hellbound,6.6,"Crime,Drama,Fantasy",32000,"Unearthly beings deliver bloody condemnations, sending individuals to hell and giving rise to a religious group founded on the idea of divine justice.",Kim Hyun-joo,Aria Song,2021-01-01,2021-01-01,"['Kyu-Seok Choi', 'Yeon Sang-ho']",['Yeon Sang-ho'],tt12235718,https://m.media-amazon.com/images/M/MV5BMjIwMDBlZjItNzMyMi00NjQwLWEzOTgtNGFmZTA0NThiMDhkXkEyXkFqcGc@
48,ONE: High School Heroes,7.7,"Action,Drama",1200,"A model student, once focused solely on grades, faces domestic abuse and school bullying. Joining forces with classmates, he forms ""High School Heroes,"" a group that fights back against bullies on behalf of the victims.",Kim Joo-ryoung,Lee Jeong-Ha,2025-01-01,2025-01-01,['\\N'],['Seong-Tae Lee'],tt34622123,https://m.media-amazon.com/images/M/MV5BMGM2MzE3NmItZmU2OS00Njg0LWFlYWItZGM0NzNkZDRmNmI5XkEyXkFqcGc@
49,Moving,8.4,"Action,Adventure,Fantasy",15000,The quiet lives of three high school students with genetic superhuman abilities turn upside down when a mysterious organization starts to hunt them down one by one.,Ryu Seung-ryong,Han Hyo-joo,2023-01-01,2023-01-01,['Kang Full'],"['Jessica Blue', 'Park In-je', 'Younseo Park']",tt24640580,https://m.media-amazon.com/images/M/MV5BNTg4NTI5NmItNGJjNC00ZmFhLTg0NzctZWQxZjAzYTAyNTQwXkEyXkFqcGc@
50,Karma,7.6,"Crime,Drama,Thriller",6400,"Bound by their harrowing destinies, a physician plagued by nightmares, a man shaken after his world was unexpectedly disrupted and a debtor drowning in private loans become caught in inescapable circumstances.",Park Hae-soo,Shin Min-a,2025-01-01,2025-01-01,['Il-Hyeong Lee'],['Il-Hyeong Lee'],tt29921070,https://m.media-amazon.com/images/M/MV5BM2MxOWNmOTUtM2U1MS00MmViLTg5NjgtYmM5YmQxOWM0NjRiXkEyXkFqcGc@
52,A Time Called You,8.0,"Drama,Fantasy,Mystery",7000,"A grieving woman magically travels through time to 1998, where she meets a man with an uncanny resemblance to her late love.",Ahn Hyo-seop,Ahn Hyo-seop,2023-01-01,2023-01-01,['Choi Hyo Bi'],['Kim Jin-won'],tt21627438,https://m.media-amazon.com/images/M/MV5BZGZkYjQyYjYtMjRhYy00Mjc0LTk2NDMtZmUyYWM0YzA2OTc2XkEyXkFqcGc@
53,My Dearest,8.9,"Drama,History,Romance",4500,A love-story between a noble woman and a mysterious man set in Joseon during the Qing invasion,Min Nam-koong,Lee Ho-Cheol,2023-01-01,2023-01-01,['Hwang Jin-young'],"['Lee Han-Joon', 'Kim Sung-yong']",tt26228190,https://m.media-amazon.com/images/M/MV5BZjc5ZDllZjAtMjJmMC00ZGRmLWE3NjYtYmMxMjUxNGI3OTBlXkEyXkFqcGc@
55,Love Next Door,7.6,"Comedy,Romance",9400,"Renowned young architect Choi Seung-hyo runs the atelier ""In."" Bae Seok-ryu, his childhood friend, rejoins his life after quitting her corporate job, resurfacing memories he'd rather forget from their peculiar childhood bond.",Jung Hae-in,Jung So-min,2024-01-01,2024-01-01,['Ha Eun Shin'],['Je Won Yu'],tt30446769,https://m.media-amazon.com/images/M/MV5BZDg2M2Y4NWQtMGY3NS00ODE3LWFmMWEtYjgyZjVjZmU0YTU5XkEyXkFqcGc@
56,Taxi Driver,8.1,"Action,Crime,Drama",8300,The story of a deluxe taxi driver who gets revenge on behalf of his passengers. It is based on the webtoon Deluxe Taxi by Carlos and Lee Jae-jin,Lee Je-hoon,Kim Eui-sung,2021-01-01,2021-01-01,"['Carlos', 'Lee Jae-jin', 'Lee Ji-hyun', 'Oh Sang-ho']","['Joon-Woo Park', 'Bo-Seung Kang']",tt13759970,https://m.media-amazon.com/images/M/MV5BMGM1NmE1OTktZjQ1Ny00N2I0LWI1NTktYTFmMjJkODVmNWM4XkEyXkFqcGc@
57,The Worst of Evil,8.3,"Action,Crime,Drama",7100,"In the 1990s, a police officer goes undercover to infiltrate a mega crime syndicate that distributes illegal drugs across South Korea, China and Japan. His wife, a narcotics officer, is also involved.",Ji Chang-wook,Ji Chang-wook,2023-01-01,2023-01-01,['\\N'],['Han Dong Wook'],tt20600022,https://m.media-amazon.com/images/M/MV5BZmQxNjYyOWYtN2NiZi00ODBmLTk0ZTMtNTgxMzczMmVlZjVmXkEyXkFqcGc@
59,Hometown Cha-Cha-Cha,8.3,"Comedy,Drama,Romance",27000,"A big-city dentist opens up a practice in a close-knit seaside village, home to a charming jack-of-all-trades who is her polar opposite in every way.",Shin Min-a,Kim Seon-ho,2021-01-01,2021-01-01,['Ha Eun Shin'],['Je Won Yu'],tt14518756,https://m.media-amazon.com/images/M/MV5BZWFiNjBjNDQtMjMwMC00Y2Q3LWFkN2EtOGQ1MDM2M2U3YTk1XkEyXkFqcGc@
61,Gyeongseong Creature,7.4,"Action,Drama,History",16000,"In Spring 1945 in Gyeongseong, during Japanese rule over Korea, two young adults confront a strange creature born of greed, and battle against it for survival.",Park Seo-joon,Han So-hee,2023-01-01,2023-01-01,['Kang Eun-kyung'],"['Jo Yeong-Min', 'Chung Dong Yoon', 'Roh Youngsub', 'Jeong Dong-yun']",tt22352854,https://m.media-amazon.com/images/M/MV5BMWI1N2I5ZGQtNTFkMC00MjIxLTgxNTQtZTgzNDU2YjhkN2JkXkEyXkFqcGc@
63,Newtopia,6.6,"Action,Comedy,Fantasy",10000,"A soldier faces a zombie outbreak during military service. His girlfriend, an engineer, navigates zombie-ridden Seoul. Both fight through the undead-infested city, striving to reunite amid the chaos.",Park Jeong-min,Kim Jisoo,2025-01-01,2025-01-01,"['Ji Ho Jin', 'Han Jin-won']",['Yoon Sunghyun'],tt32199328,https://m.media-amazon.com/images/M/MV5BNTk3ZTY5NzUtNzQ4NS00ZDY2LWI4M2YtOWI4MzY1N2I1YjEwXkEyXkFqcGc@
66,A Shop for Killers,8.0,"Action,Drama,Mystery",9000,"An action drama in which a niece who lost her parents and grew up in the hands of an uncle who runs a shopping mall, faces a new truth after her uncle's sudden death.",Lee Dong-wook,Kim Hye-jun,2024-01-01,2024-01-01,"['Ji Ho Jin', 'Kwon Lee']",['\\N'],tt26450613,https://m.media-amazon.com/images/M/MV5BZmY4ZTI3Y2QtNWIxMS00YzU4LWEyYjItZDgzYjA5NzU3ZjY2XkEyXkFqcGc@
68,Our Movie,8.9,"Drama,Romance",2100,"A film director in a slump falls in love with a terminally ill actress, who finally tries to live as the main character at the end of her own life.",Min Nam-koong,Jeon Yeo-been,2025-01-01,2025-01-01,"['Han Ga Eun', 'Kang Gyeong Min']",['Jung-Heum Lee'],tt36807294,https://m.media-amazon.com/images/M/MV5BMDc5ZWQwZGMtOWQyMy00MDZkLTlmMGEtOGZjMTc3YzE5NGVlXkEyXkFqcGc@
69,Dear Hongrang,7.6,"Drama,History,Mystery",3200,"Jae-i's search for her brother takes her on a journey of self-discovery and love. Along the way, she must confront the dark secrets of her family and the dangers of the Joseon era.",Lee Jae-wook,Jo Bo-ah,2025-01-01,2025-01-01,['Jin A Kim'],['Kim Hong-sun'],tt27554348,https://m.media-amazon.com/images/M/MV5BZjBlZDVlZDgtMGZlNC00OGU4LWFjZjYtZDhhY2Y1YjczMTRmXkEyXkFqcGc@
70,The Trauma Code: Heroes on Call,8.4,Drama,9300,An elite team of trauma specialists at a university hospital led by the genius doctor Baek Kang-hyeok.,Ju Ji-hoon,Choo Young-woo,2025-01-01,2025-01-01,"['Tae-Kang Choi', 'So Hyun-kyung']",['Do-yun Lee'],tt28106730,https://m.media-amazon.com/images/M/MV5BYzY4YmRmNmQtNTM4OC00NjhiLTk1ODQtZWRiMDY5NTAyNDliXkEyXkFqcGc@
74,The 8 Show,7.2,"Comedy,Drama,Horror",20000,"Eight contestants in financial hardship take part in Money Game, a reality competition with 44.8 billion won up for grabs. To win they must endure 100 days in a sparse studio as all purchases carry a 1000x markup, subtracted from the prize",Park Hae-joon,Ryu Jun-yeol,2024-01-01,2024-01-01,['Bae Jin Soo'],"['Kate Marley', 'Han Jae-rim']",tt30423279,https://m.media-amazon.com/images/M/MV5BYjM1OWEzZDctMTZkZS00ZjIyLTk5OGEtZGIzZWZhNjNlNmM5XkEyXkFqcGc@
75,The King's Affection,8.0,"Drama,Romance",7900,"The story is set during the Joseon Dynasty when twins were considered an ominous sign. When the Crown Princess Consort gives birth to twins, an order is sent to kill the daughter. To save her, she is secretly sent out of the palace.",Park Eun-bin,Park Eun-bin,2021-01-01,2021-01-01,"['Han Hee-Jung', 'Lee So-Young']",['Hyun Wook Song'],tt14609428,https://m.media-amazon.com/images/M/MV5BMjQ4OGFkZDItY2I2MC00YzI0LTliZmUtNGFhODUwYjZkZGM3XkEyXkFqcGc@
76,Light Shop,7.8,"Drama,Horror,Mystery",5800,The living and the dead intersect as this world and the afterlife are connected through a store selling lighting.,Bae Sung-woo,Ju Ji-hoon,2024-01-01,2024-01-01,['Kang Full'],['Kim Hee-won'],tt31014115,https://m.media-amazon.com/images/M/MV5BMmVmMjFjMmItMjRkMC00ODUzLTk3YzgtMDg4YTBlYmQ4ZDY1XkEyXkFqcGc@
77,Destined with You,7.6,"Comedy,Drama,Fantasy",8200,"Follows a successful lawyer who has everything, but who is plagued by a family curse, and turns out that the one who holds the secret to breaking it is the seemingly ordinary civil servant.",Jo Bo-ah,Jo Bo-ah,2023-01-01,2023-01-01,['Noh Ji Sul'],['Nam Ki Hoon'],tt27974068,https://m.media-amazon.com/images/M/MV5BMThjOGNlMGYtNzYzYy00NTVjLThiMGQtMDZjNTBlMDdmMWQwXkEyXkFqcGc@
78,When the Phone Rings,5.8,"Drama,Mystery,Romance",91000,"Baek Sa Eon, a former presidential spokesman, marries Hong Hui Ju, a mute newspaper heiress, in an arranged union. When Hui Ju is kidnapped, their distant relationship is challenged as they navigate the crisis.",Yoo Yeon-seok,Chae Soo-bin,2024-01-01,2024-01-01,['Ji Woon Kim'],['Park Sang Woo'],tt33503491,https://m.media-amazon.com/images/M/MV5BZWMyMjRkYzMtZDMyNS00ZTEwLTg3ZmMtYTljZDMxMjg2MjNhXkEyXkFqcGc@
79,Marry My Husband,7.8,"Comedy,Drama,Fantasy",11000,"A story about Ji-won who after being killed by her husband who had an affair with her best friend, goes back 10 years in the past and has a chance to change her fate.",Park Min-young,Na In-woo,2024-01-01,2024-01-01,"['Seong So Jak', 'Shin Yudam']",['Won-Kook Park'],tt26628595,https://m.media-amazon.com/images/M/MV5BZTY0MTI2OWQtNmMwOS00YmRkLWJhMWMtZjkxZjgwZjA2ZDU0XkEyXkFqcGc@
84,Beyond Evil,8.1,"Drama,Mystery,Thriller",7000,"The story of two fearless men who are willing to go through extreme lengths in their pursuit of a returning serial killer. To uncover the murderer's identity, the two are forced to look deeper than what the evidence seems to suggest.",Shin Ha-kyun,Yeo Jin-goo,2021-01-01,2021-01-01,['Kim Su-jin'],['Shim Na-yeon'],tt13634872,https://m.media-amazon.com/images/M/MV5BMzczNWM4ZDAtYzljMC00NTcwLWFlNzAtNGQ2ZWVkZDhjOGJiXkEyXkFqcGc@
86,Welcome to Samdalri,8.0,"Comedy,Drama,Romance",9100,"After suffering a fall from grace, a photographer returns to her hometown and bumps into her childhood friend, rekindling an unfinished romance.",Ji Chang-wook,Shin Hye-sun,2023-01-01,2023-01-01,['Kwon Hye-joo'],['Cha Yeong-hoon'],tt26653824,https://m.media-amazon.com/images/M/MV5BZTRkMmFmM2YtYmFiYi00NGZkLWIzOTUtNGYxOGMxMjRmNWRkXkEyXkFqcGc@
87,My Dearest Nemesis,7.3,"Comedy,Drama,Romance",2700,"Baek Su Jeong leads a planning team at a renowned department store. She meets her new boss, Ban Ju Yeon, her first love from an online game 16 years ago, stirring up memories of when he confessed his feelings but she rejected him.",Moon Ga-young,Choi Hyun-wook,2025-01-01,2025-01-01,['Su Yeon Kim'],['Su Hyun Lee'],tt33320428,https://m.media-amazon.com/images/M/MV5BYzJjMDVmOGEtZjlkYy00YTU0LThhYTUtNzY0MDc0NGNjN2I2XkEyXkFqcGc@
88,A Killer Paradox,7.1,"Comedy,Crime,Thriller",9300,"When one accidental killing leads to another, an ordinary young man finds himself stuck in an endless cat-and-mouse chase with a shrewd detective.",Choi Woo-sik,Son Suk-ku,2024-01-01,2024-01-01,"['da-Min Kim', 'Ggomabi', 'Chang-hee Lee']",['Chang-hee Lee'],tt28642796,https://m.media-amazon.com/images/M/MV5BYmU3MjZhNjYtODI2Yi00Nzg4LTg0NTctNWNmZDhhNmNiNWQ2XkEyXkFqcGc@
91,Our Unwritten Seoul,7.9,\N,4200,"Identical twin sisters with opposite lives - one a former athlete living freely, the other a corporate perfectionist switch places with each other, despite their contrasting personalities.",Park Bo-young,Park Bo-young,2025-01-01,2025-01-01,['Kang Lee'],"['nm17729856', 'Park Shin-woo']",tt36724865,https://m.media-amazon.com/images/M/MV5BZDQ2ODhjNGEtOWE3Ny00NDgzLTg0NWYtZDM0YTk3ODk0ZGRjXkEyXkFqcGc@
92,Our Blues,8.6,"Drama,Romance",5000,Romance is sweet and bitter - and life riddled with ups and downs - in multiple stories about people who live and work on bustling Jeju Island.,Lee Byung-hun,Shin Min-a,2022-01-01,2022-01-01,['Hee-gyoung Noh'],"['Lee Jung-mook', 'Kim Kyoo-tae', 'Kim Yang-hui']",tt19115260,https://m.media-amazon.com/images/M/MV5BMDUwY2ZkMGYtMTJlMi00MTg0LWJiNGItYzI5YmE3Y2UxYzBiXkEyXkFqcGc@
96,"Nevertheless,",7.0,"Drama,Romance",13000,The intoxicating charm of a flirtatious art school classmate pulls a reluctant love cynic into a friends-with-benefits relationship.,Han So-hee,Song Kang,2021-01-01,2021-01-01,"['Jung Seo', 'Jung Won']",['Kim Ga-ram'],tt14518284,https://m.media-amazon.com/images/M/MV5BYmJmYmQ4NjYtZGYxYS00NmNjLTk0OTQtZjYyYWRhYTcwZmFjXkEyXkFqcGc@
97,Tastefully Yours,7.3,"Comedy,Drama,Romance",3500,"A food company heir running Seoul's top restaurant meets a passionate rural chef. Despite his indifference to taste, they develop feelings while operating a small eatery together in Jeonju.",Kang Ha-neul,Go Min-si,2025-01-01,2025-01-01,['Jung Soo Yoon'],['Park Dan-hee'],tt36722167,https://m.media-amazon.com/images/M/MV5BZDA5NjMwODktNzE0My00MGMxLTlhMzQtZDU2YTRjMzRlNDUwXkEyXkFqcGc@
99,Doctor Slump,7.5,"Comedy,Drama,Romance",6600,"Once rivals in school, two brilliant doctors reunite by chance - each facing life's worst slump and unexpectedly finding solace in each other.",Park Hyung-sik,Park Shin-hye,2024-01-01,2024-01-01,['Baek Seon-woo'],['Hyun Jong Oh'],tt27135274,https://m.media-amazon.com/images/M/MV5BZDJjNmU1ZTktMTc0Ni00MzcwLTllN2MtMmQ4ZmM1MmRjMmExXkEyXkFqcGc@
