,title,rating,genres,votes,synopsis,mainLead1,mainLead2,startYear,endYear,writer,director,id,image_url
507,Zombieverse,4.5,"Comedy,Game-Show,Horror",1300,"In Seoul, where a zombie virus outbreak has run amok, who will outwit the undead in the face of challenging quests and come out alive?",Anzu Lawson,Elaine Wang,2023-01-01,2023-01-01,['\\N'],['\\N'],tt26770113,https://m.media-amazon.com/images/M/MV5BYTNkOTI5NGUtMzc1MC00MTA2LWFmZmMtYzNhYzY2NDkzYmVmXkEyXkFqcGc@
508,Love in Contract,6.9,"Comedy,Drama,Romance",2100,Tells the story of a helper service that provides wives to single people needing partners to take to gatherings for married couples and school reunions.,Park Min-young,Go Kyung-pyo,2022-01-01,2022-01-01,['\\N'],['Sung-Woo Nam'],tt22189294,https://m.media-amazon.com/images/M/MV5BM2RkOGMzMWQtODU2Ni00Y2E0LThjMDEtZGFjN2YzNTFkMjVjXkEyXkFqcGc@
512,Miss Night and Day,7.6,"Comedy,Fantasy,Romance",2600,"A bittersweet romantic comedy about a woman who magically switches between her 20s and 50s lands an internship at the Prosecution Service, caught between two generations and a tough boss.",Jung Eun-ji,Baek Seo-hoo,2024-01-01,2024-01-01,['Park Ji-Ha'],"['Chung Yeakyung', 'Lee Hyeong-min']",tt30368332,https://m.media-amazon.com/images/M/MV5BY2ExMjg0YTYtNjI1Yy00NWQ0LTk2ZTUtYzhlMDgyMGQ1OGFjXkEyXkFqcGc@
518,EXchange,8.6,"Reality-TV,Romance",116,Ex-couples who broke up for various reasons gather to look back on their past love and to find new love.,Kim Ye-won,Kim Ye-won,2021-01-01,2021-01-01,['\\N'],['Lee Jin-joo'],tt28893202,https://m.media-amazon.com/images/M/MV5BZmNmMjg2NGYtNGVmZi00MDU2LWI0ODItN2RiNTM2MjRkZjIzXkEyXkFqcGc@
519,Armored Saurus,5.9,"Action,Adventure,Family",23,Armored dinosaurs with mechanical powers and their trained pilots fight against extraterrestrial invaders that are set on destroying Earth.,Cal Brady,Cal Brady,2021-01-01,2021-01-01,['\\N'],['Dae-Il Kang'],tt16245824,https://m.media-amazon.com/images/M/MV5BYTc3ZDdiYjAtOWJlMy00NGQwLTg2MzItYTBkODQ5Yjc2MDYwXkEyXkFqcGc@
522,Romance in the House,6.7,"Drama,Romance",1300,"After his business crashes, a man disappears from his family for 11 years; when he makes a return as their wealthy landlord, a messy reunion ensues. The story of imperfect humans meeting as a family and dreaming of perfect love.",Ji Jin-hee,Kim Ji-Soo,2024-01-01,2024-01-01,['\\N'],['Kim Da-Ye'],tt32889672,https://m.media-amazon.com/images/M/MV5BNDUxMGFhOWYtNWVmNy00NDc1LWI1YzItNWQ4ZDczNDc0MDFiXkEyXkFqcGc@
524,So I Married My Anti-Fan,7.2,"Comedy,Music,Romance",2600,The romance between top star Hoo Joon and his anti-fan reporter Lee Geun Young who end up living together.,Choi Tae-joon,Sooyoung Choi,2021-01-01,2021-01-01,"['Nam Ji-Yeon', 'Eun-Jeong Kim']",['Cheol Woo Kang'],tt14518610,https://m.media-amazon.com/images/M/MV5BOTMxNTM0YzMtNzk5Mi00OWE5LWE1MDktYWY1ZWYwNDhhMzRlXkEyXkFqcGc@
525,Numbers,7.1,"Action,Drama,Thriller",513,"The story of Jang Ho-woo, a high school graduate accountant, realizing justice against the absurdity of a giant accounting firm.",Kim Myung-soo,Choi Jin-hyuk,2023-01-01,2023-01-01,['\\N'],['\\N'],tt26689977,https://m.media-amazon.com/images/M/MV5BNzVjM2FjMjMtM2Q3MC00Y2ZkLWJlM2QtZTkwZjJkZmM3NzNiXkEyXkFqcGc@
526,The Sound of Magic,7.5,"Drama,Fantasy,Music",6400,"When she was little, Yun Ai dreamed of becoming a magician. But in reality, she's just a high school student who can't even afford new socks. After meeting a mysterious magician at a carnival, she decides to follow her dream.",Ji Chang-wook,Hwang In-Youp,2022-01-01,2022-01-01,['Ha Il-Kwon'],['Kim Seong-yoon'],tt14460684,https://m.media-amazon.com/images/M/MV5BMTkyNmQwMjAtZmI3Ny00ZjE5LWIwNmEtY2Q1YWMxMTUxNDRmXkEyXkFqcGc@
528,Cafe Minamdang,7.4,"Comedy,Crime,Drama",2600,A story about a former criminal profiler who now works as a fraudster posing as a fortune teller and the female detective who gets involved with him.,Seo In-guk,Oh Yeon-Seo,2022-01-01,2022-01-01,['Jae-Hyun Ko'],['\\N'],tt21049186,https://m.media-amazon.com/images/M/MV5BOTRiMzY5OGUtNzhhNi00NDQ1LWEwZDUtZmQ5ODFkNjhhNGRjXkEyXkFqcGc@
534,"Link: Eat, Love, Kill",7.3,"Crime,Drama,Fantasy",2100,A crime mystery thriller fantasy about a man and woman sharing same emotions. Gye Hoon is a chef whose twin sister went missing. Now he finds his random emotions connected with a girl named Da Hyun.,Moon Ga-young,Yeo Jin-goo,2022-01-01,2022-01-01,['Kwon Ki-yeong'],['Hong Jong-chan'],tt20869584,https://m.media-amazon.com/images/M/MV5BMDk2ZDNiMGQtNWQwZC00NjgyLWI5ZTQtNjMzM2E0ZDEwZmIyXkEyXkFqcGc@
535,Law School,7.9,"Crime,Drama,Mystery",3700,"When a grim incident occurs at their prestigious school, justice through law is put to a test by a tough law professor and his ambitious students.",Kim Myung-min,Kim Bum,2021-01-01,2021-01-01,['Seo In'],"['Suk-Yoon Kim', 'Christine Ko']",tt13885336,https://m.media-amazon.com/images/M/MV5BMDA1OTE1MTQtNzdjZC00MzE4LWEzZjMtYTIxZjFkM2JjZjNhXkEyXkFqcGc@
536,The Interest of Love,6.5,"Drama,Romance",1800,Four men and women working at the same bank get entangled in a complicated romance as they discover how far they're willing to go for love.,Yoo Yeon-seok,Moon Ga-young,2022-01-01,2022-01-01,"['Lee Seo Hyun', 'Lee Hyun Jung']",['Jo Young Min'],tt24224910,https://m.media-amazon.com/images/M/MV5BYzJkZTA4NTEtN2U3My00MmFjLWIzZTItOTliYTU1YTgyYjI4XkEyXkFqcGc@
537,Love All Play,7.7,"Drama,Romance,Sport",1300,A romantic sports drama depicting the passion and affection for badminton of a male and female protagonist who are a mixed doubles group with players from the commercial badminton team.,Park Ju-hyun,Chae Jong-hyeop,2022-01-01,2022-01-01,"['Dawn Anderson', 'Sung-hye Heo']","['Jessica Blue', 'Jo Woong']",tt19851552,https://m.media-amazon.com/images/M/MV5BMjA4NWIyMmQtZjVkZi00ODZlLThiYjctM2IxNWE0NzM2OTQ0XkEyXkFqcGc@
538,Navillera,8.7,Drama,3800,A 70-year-old with a dream and a 23-year-old with a gift lift each other out of harsh realities and rise to the challenge of becoming ballerinos.,Park In-hwan,Song Kang,2021-01-01,2021-01-01,"['Lee Eun-Mi', 'Hun', 'Jimin']",['Han Dong-hwa'],tt13885302,https://m.media-amazon.com/images/M/MV5BMWUyMmUyNjMtNWE5Zi00N2EwLWE1Y2EtNWFhNzI4OWZiM2M5XkEyXkFqcGc@
539,"Now, We Are Breaking Up",6.4,"Drama,Romance",1800,The series is story of love and break ups in the romantic world. It illustrates the present scenario in the context of fashion industry,Song Hye-kyo,Jang Ki-yong,2021-01-01,2021-01-01,['In Je'],['Lee Gil-Bok'],tt14408016,https://m.media-amazon.com/images/M/MV5BZmU3NGI0MWEtMzJkZC00YWNmLThlMjUtOTVhYWI4NjBmMmE2XkEyXkFqcGc@
542,The Story of Park's Marriage Contract,7.5,"Comedy,Fantasy,History",2100,"When a widowed Joseon noblewoman is kidnapped and tossed into a well, it turns out to be a portal to present-day Seoul. Out of her element, she enters a contract marriage with a cold chaebol who looks just like her deceased husband.",Lee Se-yeong,Bae In-hyuk,2023-01-01,2023-01-01,"['Angelique', 'Dotda', 'Neo-Wool Kim']",['\\N'],tt26679485,https://m.media-amazon.com/images/M/MV5BOGY3MDAxMDItY2ViZi00OGY5LTk5N2EtMjdkZmQzYjU0MTdhXkEyXkFqcGc@
543,School 2021,7.1,"Comedy,Romance",561,"The story of students of a specialized high school seeking their ambitions, rather than going off to college. It will delve into how these students learn about love, friendship, true passions, and growing up in an intense environment.",Kim Yo-han,Choo Young-woo,2021-01-01,2021-01-01,"['Jo Ah-Ra', 'Hee-seon Dong', 'Lee Hyun']",['Kim Min-Tae'],tt15140382,https://m.media-amazon.com/images/M/MV5BMzc4YTNlNzUtYTM0MS00MTI1LTk2MGYtMDY0OGE4ZDc5NjJmXkEyXkFqcGc@
546,True Beauty,6.8,"Animation,Comedy,Drama",379,"A thrilling tale of beauty, intrigue, and self-discovery unfolds. Will Jugyeong conquer it all or succumb to the pressures of the beauty-obsessed world around her?",Rebecca Danae,Eduardo Vildasol,2024-01-01,2024-01-01,['Yaongyi'],['\\N'],tt33054444,https://m.media-amazon.com/images/M/MV5BNzBjYWUyYjYtZmQ1Mi00NzhkLWJmNGEtZjI3OGM1NzcxMWU2XkEyXkFqcGc@
550,My Man is Cupid,7.1,"Comedy,Fantasy,Mystery",1600,A cupid from 500 years awaiting his release meets a woman born with no red thread of love for all her incarnations. What would happen when they take an interest in each other amidst a series of serial killings and a complicated past life?,Jang Dong-yoon,Im Jin-ah,2023-01-01,2023-01-01,['Seong-hee Heo'],['Tae-Jin Nam'],tt30241060,https://m.media-amazon.com/images/M/MV5BMTNmODVlMjctMmE2NC00YTFkLWI3NjMtZjhjMGU2MDBiMWUxXkEyXkFqcGc@
551,Kian's Bizarre B&B,8.6,Reality-TV,2200,"Kian84 manages an unconventional guesthouse, Kian Bizarre B&B, on Ulleungdo Island, providing a distinctive experience for young guests. The establishment combines elements of healing and humor, presented through Kian84's distinctive lens.",Trish Le,Marc Fajardo,2025-01-01,2025-01-01,['\\N'],['\\N'],tt33047061,https://m.media-amazon.com/images/M/MV5BN2MwNzBiNzktZDI3YS00OTcyLTllZDYtZGQxNTRmMmE1ZjIzXkEyXkFqcGc@
553,Doctor Lawyer,7.2,"Crime,Drama,Thriller",871,Follows a surgeon who becomes a lawyer after a case of surgical malpractice.,So Ji-seob,Im Soo-hyang,2022-01-01,2022-01-01,"['Jang Hong-cheol', 'Dave Wallace']",['Lee Yong-Suk'],tt20854190,https://m.media-amazon.com/images/M/MV5BMmY0Yjc2NzEtMDRiNS00ZDM2LTk3YjMtOWZhZTIzYWJkYjI0XkEyXkFqcGc@
555,Racket Boys,5.1,"Comedy,Drama,Sport",30000,A city kid is brought to the countryside by his father's new coaching gig; reviving a ragtag middle school badminton team on the brink of extinction.,Kim Sang-kyung,Oh Na-ra,2021-01-01,2021-01-01,['Bo-Hoon Jung'],['Jo Yeong-Gwang'],tt14482414,https://m.media-amazon.com/images/M/MV5BYWVlNjI0NzQtMmRlZS00YmUzLWIxNjctNThiODBlOTQzN2Y5XkEyXkFqcGc@
556,Military Prosecutor Do Bae Man,7.7,"Action,Drama",2000,Do Bae Man and Cha Woo In begin to work together as they break down evils in the military.,Ahn Bo-hyun,Jo Bo-ah,2022-01-01,2022-01-01,['Hyun Ho Yoon'],['Chang Gyu Jin'],tt17346230,https://m.media-amazon.com/images/M/MV5BZjA4YjVlYzYtM2YyNC00MTYwLWFmMjMtMjNhNDU5ZGEyMDg5XkEyXkFqcGc@
557,Miraculous Brothers,7.6,"Drama,Fantasy,Mystery",895,"An aspiring writer deep in debt encounters a young man with no memories and strange abilities. Together, they fight injustice and form an unlikely bond.",Jung Woo,Bae Hyun-Sung,2023-01-01,2023-01-01,['\\N'],['Chan-hong Park'],tt27906926,https://m.media-amazon.com/images/M/MV5BODFmMmUwOGEtMzZmMi00MThhLWFiMDItODA5NGNlNDBiNGM2XkEyXkFqcGc@
560,What Comes After Love,7.8,"Drama,Romance",2100,A sentimental melodrama depicting the aftermath of a fateful love between a woman named Hong who has forgotten everything and a man named Jungo who is full of regrets.,Hong Jong-hyun,Lee Se-yeong,2024-01-01,2024-01-01,"['Hae-sim Jung', 'Hyun-Sung Moon']",['Hyun-Sung Moon'],tt33204672,https://m.media-amazon.com/images/M/MV5BMDM4ODc1ZjAtZDAzNS00Njg2LTg1NmYtZjgwYWViZDE1N2Q2XkEyXkFqcGc@
565,Spice Up Our Love,6.7,"Comedy,Drama,Fantasy",929,"Kang Ha Jun, president of GB Electric, seems cold but is affectionate to his love interest. As a chaebol, he learns about love when he meets Seo Yeon Seo, facing her overnight change and intense romance.",Han Ji-Hyun,Han Ji-Hyun,2024-01-01,2024-01-01,['\\N'],['\\N'],tt33143834,https://m.media-amazon.com/images/M/MV5BNWUyN2E4OWUtYWZkNS00MDA3LTkyYmQtYTJlMDg0N2Y4OTEzXkEyXkFqcGc@
566,Big Bet,7.1,"Action,Crime,Drama",908,A crime-action drama about a casino king who is taking risks and trying to get back into the game. Betrayal is rampant in the presence of money. Who will be the last person standing?,Choi Min-sik,Son Suk-ku,2022-01-01,2022-01-01,['Yunsung Kang'],['Yunsung Kang'],tt17329616,https://m.media-amazon.com/images/M/MV5BN2U4NjJmNjItNTBhOS00YTRlLTllZWMtMDkwNTg1MjA2MWY0XkEyXkFqcGc@
569,Good Partner,7.8,"Comedy,Crime,Drama",608,"Cold and hot human court office drama between Cha Eun-kyeong (Jang Na-ra), a star lawyer whose divorce is her calling, and Han Yoo-ri (Nam Ji-hyun), a new lawyer whose divorce is her first time.",Jang Na-ra,Nam Ji-hyun,2024-01-01,2024-01-01,['Choi Yoo-na'],['Kim Ga-ram'],tt32840498,https://m.media-amazon.com/images/M/MV5BNWIzNjQ0MjAtNTY2ZS00ZTQwLWJjYzItODNkMzY5ZTkzNTU3XkEyXkFqcGc@
570,Bee & Puppycat: Lazy in Space,8.5,"Animation,Comedy,Sci-Fi",1300,The second season of beloved web series Bee and PuppyCat after a nearly five year break. The season picks back up the cheerful 22-year old Bee and intergalactic space warrior for a set of adventures.,Allyn Rachel,Ashly Burch,2022-01-01,2022-01-01,"['Natasha Allegri', 'Pendleton Ward', 'Etta Devine', 'Gabriel Diani', 'Ross Kolde', 'Efrain Farias', 'Hans Tseng', 'Jack Pendarvis']","['Jji Shimura', 'Hideaki ba', 'Akane Itoda', 'Shuntaro Tozawa', 'Eri Ueda', 'Aoi Yamato', 'Efrain Farias', 'Hans Tseng', 'Pendleton Ward']",tt13259622,https://m.media-amazon.com/images/M/MV5BZDQ3MWQyMDAtNmMzZC00ZTUwLWE3MjItODYxZjhiZTQ0NDgzXkEyXkFqcGc@
572,Tell Me That You Love Me,8.1,"Drama,Romance",1300,"A healing melodrama about the fate of Cha Jin-woo, a deaf person who is used to express emotions through pictures instead of words, and Jeong Moo-eun, who expresses her heart with her voice.",Jung Woo-sung,Shin Hyeon-bin,2023-01-01,2023-01-01,['\\N'],['Kim Yoon-jin'],tt29569080,https://m.media-amazon.com/images/M/MV5BY2RjMzUwMjUtOGJiMS00YWNmLWI0ZWMtM2UxYmYxMWI1M2FlXkEyXkFqcGc@
575,Bebefinn,5.5,"Animation,Family,Music",45,Join baby Finn and his family on fun-filled adventures while learning something new every time. Get ready to sing and dance.,Bommie Han,Bang Marshall Jeanwon,2022-01-01,2022-01-01,"['Joey Clift', 'Chris Nee', 'Karissa Valencia']",['\\N'],tt30797164,https://m.media-amazon.com/images/M/MV5BMzllM2QzYmQtNWY4Yi00MTYxLWIzYTMtYzJkMWQ4M2FjNzllXkEyXkFqcGc@
577,Dali and the Cocky Prince,8.0,"Comedy,Drama,Romance",2400,"It is about the romance between a parvenu who lacks education, and the daughter of a prestigious family who tries to save a collapsed art museum.",Park Gyuyoung,Kim Min-jae,2021-01-01,2021-01-01,"['Son Eun-hye', 'Park Se-Eun']",['Lee Jung-seob'],tt14730768,https://m.media-amazon.com/images/M/MV5BNzVkODY0YTMtNDFiOC00YTMzLWFhYmYtZDhkY2NhZjkyZTc4XkEyXkFqcGc@
578,If You Wish Upon Me,7.9,"Drama,Romance",2100,"Yoon Gyeo Rye lived at an orphanage and spent time in prison. He struggles to have a normal life. He volunteers at a hospice. There, he works with volunteer team leader Kang Tae Sik and nurse Seo Yeon Joo.",Ji Chang-wook,Sooyoung Choi,2022-01-01,2022-01-01,['Jo Young Soo'],['Kim Yong-wan'],tt20600078,https://m.media-amazon.com/images/M/MV5BNDM4OGE0Y2ItNzQ4OS00YzUxLTgxYjEtZDQyOTQ1MTU5MDQzXkEyXkFqcGc@
580,My Happy End,6.4,"Drama,Thriller",407,"A heroine, who spent her poor childhood, trying to escape her desire and obsession after running through life drunk with success.",Jang Na-ra,Son Ho-joon,2023-01-01,2023-01-01,['\\N'],['Jo Soo-won'],tt29720810,https://m.media-amazon.com/images/M/MV5BNTFmOWYxY2UtZmExNy00ZDRlLTg5NmMtZjYwNmUzZmY2YjdkXkEyXkFqcGc@
581,True to Love,7.6,"Comedy,Romance",1500,"A romantic comedy between Deborah, the greatest love coach, and Lee Soo-hyeok, a publishing planner who has difficulty loving.",Yoon Hyun-min,Joo Sang-uk,2023-01-01,2023-01-01,['\\N'],['Tae-gon Lee'],tt26763160,https://m.media-amazon.com/images/M/MV5BYjAzMzI1YTMtODMyMy00ZWFjLTgzOWItODJiMzJlZTk0ZWVlXkEyXkFqcGc@
582,The Escape of the Seven,6.1,"Drama,Mystery,Thriller",666,"A girl disappears from the world due to the Bobble Incident, and seven evil people are involved in the incident.",Uhm Ki-joon,Lee Joon,2023-01-01,2023-01-01,['Kim Soon-ok'],['Dong Min-joo'],tt29198828,https://m.media-amazon.com/images/M/MV5BOTg3ZWU0ZmUtODc3NS00OGUxLTk5NTctMTM0NTk2NGNmZTEwXkEyXkFqcGc@
584,Secret Royal Inspector Joy,7.2,"Comedy,Drama,History",1100,"Set in Joseon dynasty, it tells the story of a young gourmet who unintentionally becomes a royal inspector and a divorced woman who rushes to find happiness, as they team up to investigate and defeat corrupt politicians.",Taecyeon,Kim Hye-yoon,2021-01-01,2021-01-01,"['Kim Soi', 'Jae-yun Lee']","['Yeo Jin Jeong', 'Nam Seongu', 'Jong Sun Yoo']",tt15181018,https://m.media-amazon.com/images/M/MV5BMjk1NDFiYzQtZmE0Ni00ZThiLWFiYzMtYzgwZmQ1YjgwYTdjXkEyXkFqcGc@
586,Cheer Up,6.8,"Comedy,Drama",2000,"Do Hae-Yi is a student at Yonhee University. Because her family is poor, she places a priority on making money over school. Hae-Yi joins cheering squad Theia. She only joins the club for money but finds her joy there.",Han Ji-Hyun,Kim Hyun-jin,2022-01-01,2022-01-01,['Cha Hye Won'],['Tae-Seob Han'],tt22789182,https://m.media-amazon.com/images/M/MV5BYWMwZDliNGYtMWYzZS00N2Q5LTllNGMtY2I1NzBlNGI5OGFmXkEyXkFqcGc@
587,Pump Up the Healthy Love,7.0,"Comedy,Drama,Romance",626,"Hyun-jung, former bodybuilder and struggling gym owner, helps Mi-ran, a heartbroken woman, rebuild her life and body. As they train together, they form an unexpected bond that helps them heal, grow, and face life's challenges side by side.",Lee Jun-young,Jung Eun-ji,2025-01-01,2025-01-01,['Kim Ji-soo'],['Park Joon-soo'],tt34748793,https://m.media-amazon.com/images/M/MV5BYTRjNzI5NGEtOTc1Mi00Zjk4LTkxYTMtYzQ2ZDliOTdkZjQ2XkEyXkFqcGc@
589,Bloody Heart,7.3,"Drama,Romance",451,"Set in the Joseon Dynasty, King Lee Tae and Queen Jeong draw their swords at each other amid political conflict in this bloody romance.",Lee Joon,Kang Han-na,2022-01-01,2022-01-01,['Pil Joo Park'],['Yoo Young-eun'],tt19887704,https://m.media-amazon.com/images/M/MV5BNGE5MmNmMDItZTNmMS00ODIyLTgwMzgtZWFhOTBkNzRjMWNmXkEyXkFqcGc@
596,Death to Snow White,7.9,"Drama,Mystery,Thriller",899,"Released from prison a decade after the alleged murder of two high school friends, Jeong Woo must confront his past and the dark side of human nature that permeates his sleepy village.",Byun Yo-han,Go Joon,2024-01-01,2024-01-01,['Joo-Yeon Seo'],"['Young-Joo Byun', 'Kyu-maan Lee']",tt33131043,https://m.media-amazon.com/images/M/MV5BNjRiZWFiNTMtYjhiYy00NTkxLThkMTQtNDIwZjI3OTgwMjM5XkEyXkFqcGc@
600,Lost,8.2,"Drama,Romance",647,A forty year old woman who feels like she has not accomplished anything in life and a twenty-seven year old man who's frightened of himself.,Jeon Do-yeon,Ryu Jun-yeol,2021-01-01,2021-01-01,['Ji-hye Kim'],['Hur Jin-ho'],tt14609588,https://m.media-amazon.com/images/M/MV5BMWRiOGUwZjctZDNmZi00MzlhLTg4YzgtZTBiNWY2NjEyOTZiXkEyXkFqcGc@
602,Trolley,6.8,"Drama,Mystery",613,A sudden tragedy brings the wife of an assemblyman out of her private life and forces her to confront family secrets and her own troubling past.,Park Hee-soon,Kim Hyun-joo,2022-01-01,2022-01-01,['Ryu Bo-Ri'],['Kim Moon Kyo'],tt24224842,https://m.media-amazon.com/images/M/MV5BZTMxZTVjMjEtYjczMy00NTBlLWJhZGYtNGIwYmJmMWVlMmE4XkEyXkFqcGc@
608,Love,6.7,"Drama,Romance",759,"Everything comes unraveling for three successful women who work on a radio show as twists, turns and troubles plague their seemingly happy marriages.",Park Joo-mi,Park Seo-Kyeong,2021-01-01,2021-01-01,['Sung-han Im'],"['Yoo Jeong-Joon', 'Lee Seung-Hoon']",tt13814840,https://m.media-amazon.com/images/M/MV5BN2MzOTk3MWEtZDU4ZC00OTQ3LWJkZmMtZDhhYmU0ODNiODc2XkEyXkFqcGc@
609,My Sweet Mobster,7.6,"Comedy,Drama,Romance",1700,"An unexpected and exciting romance brews between Seo Ji Hwan, a former gang member, and Go Eun Ha, a children's content creator.",Han Sun-hwa,Um Tae-goo,2024-01-01,2024-01-01,['Na Kyung'],"['Woo Hyun Kim', 'Young Hwan Kim']",tt32380398,https://m.media-amazon.com/images/M/MV5BMjI1ZmRkZjMtOGFjZC00NGU5LWI3YmUtZDU1YjNkZThiMzkzXkEyXkFqcGc@
611,Let's Get Grabbed by the Collar,6.3,"Crime,Drama",212,A melodramatic chase thriller that tells the story of special reporter Seo Jeong-won and detective Kim Tae-heon tracking down a murder case.,Kim Ha-neul,Yeon Woo-jin,2024-01-01,2024-01-01,['\\N'],['\\N'],tt29845974,https://m.media-amazon.com/images/M/MV5BMTIzMDczMTItNDU5Yi00YzQ2LWJkNmYtNjMyNTczN2Q5MzA5XkEyXkFqcGc@
612,Quantum Heroes Dinoster,7.5,"Action,Adventure,Animation",79,"Join 4 extraordinary kids as they travel to an alternate Earth where dinosaurs never went extinct, using hi-tech suits and transforming vehicles to protect the dinos from an inter-dimensional villain intent on taking over the multiverse.",Kyra Jackson,Cenophia Mitchell,2023-01-01,2023-01-01,"['Joe Vitale', 'Arnold Mwanjila', 'Mark Zaslove', 'Nick Skarock', 'Pamela Hickey', 'Jeffrey Hylton', 'Dennys McCoy', 'John T. Reynolds', 'Sarah Blumrich']",['Nate Begle'],tt30699064,https://m.media-amazon.com/images/M/MV5BZTM3YTA5OWMtYzA0Mi00ZmJiLWJiZDUtZGUxNDUzZTlmMWIwXkEyXkFqcGc@
614,Jun & Jun,7.2,"Comedy,Romance",1300,"His childhood first love, Choi Jun, who disappeared without a word, returned as a hot general manager. An office rom-com about idol-turned-intern Lee Jun and Choi Jun, a heart-fluttering genius director.",Hyun-woo Ki,Jun-mo Yang,2023-01-01,2023-01-01,['\\N'],['\\N'],tt28407236,https://m.media-amazon.com/images/M/MV5BYmU2MDcxY2YtYmU4My00YjhlLTk4MmItZjhiYjY0ZTM2ZjA1XkEyXkFqcGc@
616,Motel California,6.5,"Drama,Romance",672,A woman raised in a motel in the countryside experiences twists and turns as she reunites with her first love in her hometown that she ran away from 12 years ago.,Lee Se-yeong,Na In-woo,2025-01-01,2025-01-01,['Seo-yun Lee'],"['Joon-Ho Jang', 'Kyungmin Kim']",tt33412844,https://m.media-amazon.com/images/M/MV5BYmZmYmVkNWQtM2YyOS00NDdkLTgyNzctZjA3NDc4YTcyODkxXkEyXkFqcGc@
618,Namibeu,6.2,"Comedy,Music",946,"Kang Soo-hyeon's life is in ruins after a false accusation gets her fired from company. She wants to work again to support her husband and their hearing-impaired son. Soo-hyeon recruits former idol Yoo Jin-woo, who was recently dropped.",Go Hyun-jung,Ryeoun,2024-01-01,2024-01-01,['Eom Seong-min'],"['Kang Min-Gu', 'Han Sang-jae']",tt34993190,https://m.media-amazon.com/images/M/MV5BNGMwYmRlZDAtNGMwMS00OTEyLTkxZmUtZDUyNTJmMWM1Nzc3XkEyXkFqcGc@
620,Iron Family,6.7,"Comedy,Drama,Mystery",1100,"Da Rim's family runs a struggling dry cleaners business. One day, she learns that she is going blind and there's a cure but it is expensive. Her family happens to find a lot of money and a man she had a fling with from her past resurfaces.",Kim Jung-hyun,Keum Sae-rok,2024-01-01,2024-01-01,['Sook Hyang Seo'],['Joon Hae Sung'],tt33085643,https://m.media-amazon.com/images/M/MV5BYWVhMzk2MDMtZGIxOS00N2JiLTkxMDctMDU4OTE0MDc3MWRjXkEyXkFqcGc@
621,Insider,7.5,"Action,Drama,Thriller",482,"After going undercover for an investigation, Kim Yo Han experiences a crisis and ends up struggling to try to obtain a hand of cards that will change his fate as he gambles in prison.",Kang Ha-neul,Lee Yoo-young,2022-01-01,2022-01-01,['Moon Man-Se'],['Min Yun-Hong'],tt14731504,https://m.media-amazon.com/images/M/MV5BNDBlZDQzM2YtYTBjYy00MTE3LTg2NGItZmJlMDY1ZmE5MmY0XkEyXkFqcGc@
630,Young Lady and Gentleman,6.4,"Comedy,Drama,Family",808,"Lee Young Kook hires Park Dan Dan as a live-in tutor, attracting her due to her charm and positive attitude despite her age difference.",Ji Hyun-woo,Lee Se-Hee,2021-01-01,2021-01-01,['Sa Kyung Kim'],['\\N'],tt15514606,https://m.media-amazon.com/images/M/MV5BNDYxNzYyYWItZjJhZi00MGFmLTllMTMtMGNkODkxMGIzZDIwXkEyXkFqcGc@
634,Business as Usual,6.9,"Drama,Romance",351,"Min Jun's mundane office life is disrupted when his ex-boyfriend, Jin Hwan, joins his workplace after 8 years. As Jin Hwan charms their coworkers, Min Jun struggles with their past and Jin Hwan's attempts to reconnect.",Sung Seung-ha,Chae Jong-hyuk,2025-01-01,2025-01-01,['Min Chae Yeon'],['Min Chae Yeon'],tt36374678,https://m.media-amazon.com/images/M/MV5BYjA1ZjgyMWEtNGRkYy00NThiLWE2YjEtNWEyMTQ2ZmIxMWNkXkEyXkFqcGc@
638,Monthly Magazine Home,7.1,"Comedy,Romance",669,A home-searching romance story about a man who buys houses and a woman who lives in one. It follows the diverse stories of the editors of a home magazine.,Kim Ji-seok,Jung So-min,2021-01-01,2021-01-01,['Soo-Hyun Myung'],['Chang-min Lee'],tt13885272,https://m.media-amazon.com/images/M/MV5BYTU1ODZkODctYTViYi00NTY2LTg5MTEtYzFkMDE5ZWU2ZGYxXkEyXkFqcGc@
642,River Where the Moon Rises,7.4,"History,Romance",713,The story of Princess Pyeonggang who was born as a princess but raised to be a soldier for Goguryeo. She dreams to be the first female Taewang of Gorguryeo but is confused about the new feelings experienced after meeting On Dal.,Kim So-hyun,Kim So-hyun,2021-01-01,2021-01-01,['Han Ji-hoon'],['Yoon Sang-ho'],tt13634686,https://m.media-amazon.com/images/M/MV5BNjQ3N2Q1YjAtNWYyZC00OGNkLWIyYmUtMzEzMTI0NjkwMWI5XkEyXkFqcGc@
645,Shadow Detective,7.1,"Crime,Drama,Mystery",593,"Detective Taekrok is ready to retire after an illustrious career in the police force, but one day he awakens to discover that he has been framed for a murder he didn't commit, and the real murderer blackmails him.",Lee Sung-min,Gyeong Su Jin,2022-01-01,2022-01-01,['Im Changse'],['Han Dong-hwa'],tt23032868,https://m.media-amazon.com/images/M/MV5BYzUyZjFiZGMtNmJjNi00ZmE4LWJiZGItZDY4MTM5ODNhYmY0XkEyXkFqcGc@
652,The Law Cafe,7.4,"Comedy,Drama,Romance",1400,Kim Jung-ho quits being a prosecutor despite a promising future after discovering the dirty secrets of his prosecutor father. Kim Yu-ri is a strong-willed and righteous woman.,Lee Seung-gi,Lee Se-yeong,2022-01-01,2022-01-01,['Im Ji-eun'],['Lee Eun-Jin'],tt21827042,https://m.media-amazon.com/images/M/MV5BMTFlNmRjMTgtODc1Zi00YThkLThlMzgtNTA3ZGI3NWQzNjlhXkEyXkFqcGc@
653,Casting a Spell to You,8.2,"Comedy,Drama,Romance",76,"Ji Woo, a wealthy man's grandson, expected a lavish inheritance but received only an antiquarian bookshop. Teaming up with Joong Hee, who fell victim to a scam, they transform the shop into an unconventional daytime bar.",Sung Jun,Lim Ji-yeon,2021-01-01,2021-01-01,['Sun-hwa Lee'],['Kyung Yong Kim'],tt30989511,https://m.media-amazon.com/images/M/MV5BNWU4MWJlMTktZDFhYS00MzI4LTk0MzUtM2ExZTM1NDNlYzVkXkEyXkFqcGc@
