,title,rating,genres,votes,synopsis,mainLead1,mainLead2,startYear,endYear,writer,director,id,image_url
217,May I Help You,7.6,Drama,1500,Baek Dong-Joo works as a funeral director who has a supernatural power that allows her to see and talk to the dead.,Lee Jun-young,Lee Hyeri,2022-01-01,2022-01-01,['\\N'],['\\N'],tt22872644,https://m.media-amazon.com/images/M/MV5BODgxZDAzZGQtYmVjNi00YTRmLTg1OWUtMzM2NzBiMDcyMjRlXkEyXkFqcGc@
220,Brewing Love,7.0,"Comedy,Drama,Romance",1200,"Chae Yong-Joo, a former special forces member and top salesperson at a liquor company, must sell a new beer to save her store from closing. She meets a sensitive brewmaster, Yoon Min-Joo, while competing with manager Bang A-Reum.",Kim Sejeong,Lee Jong-Won,2024-01-01,2024-01-01,['Jung-Sin Lee'],['Park Seon-ho'],tt33607282,https://m.media-amazon.com/images/M/MV5BNWMyYzgyOGItMmIxYi00NmZmLWFjODctYmMwZDY4NDk1N2M0XkEyXkFqcGc@
223,The Tale of Lady Ok,8.0,"Drama,History,Romance",867,"Set in the Joseon period, Ok Tae-Young is an attorney with a secret identity. Her name, her husband, and her status are all fake. She meets Cheon Seung-Hwi, a traveling storyteller who falls in love with her at first sight.",Lim Ji-yeon,Lim Ji-yeon,2024-01-01,2024-01-01,['Park Ji-sook'],"['Chung Yeakyung', 'Jin Hyuk']",tt33980640,https://m.media-amazon.com/images/M/MV5BZjkxYmU1ZjgtZWZlYS00YzY0LWIwYjItNmNhMTQ2YzZjYzFkXkEyXkFqcGc@
224,Love Your Enemy,7.4,"Comedy,Drama,Romance",1200,"Childhood enemies Seok Ji-won (man) and Yoon Ji-won (woman), born the same day with the same name, reunite 18 years later. Their families' rivalry fuels their clashes, making them troublemakers who fight at every chance.",Ju Ji-hoon,Jung Yu-mi,2024-01-01,2024-01-01,['Im Ye-Jin'],"['Bae Huiyeong', 'Park Joon-hwa']",tt33204454,https://m.media-amazon.com/images/M/MV5BNjliMTQwZWYtNDUzYi00N2E4LTg0ZDgtNTFkNWVhOTdlYzE4XkEyXkFqcGc@
227,Song of the Bandits,7.2,"Action,Drama,History",2800,"The Koreans who gathered in Gando, Manchuria, for their own reasons and band together to protect their homes during 1910-45 Japanese colonial rule.",Kim Nam-gil,Seohyun,2023-01-01,2023-01-01,['Jung-hoon Han'],['Joon-Hyeok Hwang'],tt21627436,https://m.media-amazon.com/images/M/MV5BOTc4ODRiMDItN2Y2NS00YWFjLWI0MzctODc5NzczOTQ4YWUyXkEyXkFqcGc@
229,Bulgasal,7.4,"Drama,Fantasy,Thriller",3600,"The story of a man-turned-immortal, Bulgasal, who wants revenge from a woman with a mysterious past and present, who he deems responsible for his immortality and miseries from the past 600 years, hoping to free himself from his curse.",Lee Jin-wook,Nara,2021-01-01,2021-01-01,"['So-ra Kwon', 'Jae Won Seo', 'Jang Young-woo']","['Jang Young-woo', 'Hae Ju Kim', 'Ham Seung-hoon']",tt14691616,https://m.media-amazon.com/images/M/MV5BYzJiMDhmMGEtYjc3MC00NDlkLTgzNjYtMzk3NTczOGU5MDNhXkEyXkFqcGc@
230,Unmasked,7.1,"Action,Comedy,Crime",549,A team of investigative journalists tries to solve a twenty-year-old cold case involving a famous actor who went missing.,Kim Hye-su,Jung Sung-il,2025-01-01,2025-01-01,['\\N'],['\\N'],tt31390522,https://m.media-amazon.com/images/M/MV5BNzJhMWRiMmUtMDc1My00NzQ3LWI2M2MtNGNmYzg3ZmE3NDE4XkEyXkFqcGc@
231,Pyramid Game,7.5,"Action,Drama,Thriller",2800,"Each person is graded through a popular vote against the backdrop of a girl's high school and if they receive an F grade, they become legitimate victims of school violence.",Kim Ji-yeon,Jang Da-ah,2024-01-01,2024-01-01,"['Dalgonyak', 'J.Q. Lee', 'Choi Sui']",['Bak So Yeon'],tt29311421,https://m.media-amazon.com/images/M/MV5BZDg5ZDkwODUtOTdkNy00NWM5LWFiNjUtYjc5NWRhMDQ3YmNlXkEyXkFqcGc@
236,Connection,7.8,"Action,Crime,Mystery",1400,"A story that reveals the whole story of a friendship that has been changed over 20 years based on the death of a friend of Jang Jae-kyeong, an ace detective in a drug squad who is forcibly addicted to drugs.",Ji Sung,Jeon Mi-do,2024-01-01,2024-01-01,['Lee Hyun'],['Kim Moon Kyo'],tt30422566,https://m.media-amazon.com/images/M/MV5BZjkzNGI0NmYtYWQ0OS00NDIxLThlZjgtZThlZDc4YjE2NmYwXkEyXkFqcGc@
237,Revenant,7.8,"Drama,Fantasy,Horror",3900,"Ku San Young works and studies at night to become a public officer. After receiving a relic from her dead father mysterious deaths take place around her, and she finds herself slowly changing.",Oh Jung-se,Hong Kyung,2023-01-01,2023-01-01,['Kim Eun-hee'],"['Kim Jae Hong', 'Lee Jung-rim']",tt22263470,https://m.media-amazon.com/images/M/MV5BODY2ODI3NjUtMGI3MC00Mzk0LTg1NGQtNmMwZmExZDJlZjI2XkEyXkFqcGc@
238,The Heavenly Idol,6.4,"Comedy,Drama,Fantasy",992,"A fantasy-romance drama about an unknown idol, Woo Yeon-woo, whose body was possessed by Rembrary, the god of this world.",Kim Min-kyu,Kim Min-kyu,2023-01-01,2023-01-01,['\\N'],['\\N'],tt26228426,https://m.media-amazon.com/images/M/MV5BMDQ5MDdjMTUtOWNmOC00ZWIzLWIwY2YtM2MwYWY2ZmI1ODZiXkEyXkFqcGc@
245,A Model Family,6.6,"Crime,Drama,Thriller",1700,"After unwittingly stealing money from a cartel, a cash-strapped professor finds the only way to save his broken family is by working as a drug courier.",Jung Woo,Park Hee-soon,2022-01-01,2022-01-01,"['Lee Jae-gon', 'Kim Jin-woo']",['\\N'],tt21289712,https://m.media-amazon.com/images/M/MV5BMmEwZjI1OWMtNDFkOS00MTJjLWFmYTktYzc1NzIwOTA4NTAzXkEyXkFqcGc@
246,Culinary Class Wars,8.5,"Game-Show,Reality-TV",3700,"Pits 100 renowned chefs and undiscovered talents against each other in a culinary battle. Judged by the esteemed Paik Jong-won and Chef Anh Sung-jae, the show promises to showcase the ultimate clash of culinary skills and creativity.",Bobby Foley,Eugene Ko,2024-01-01,2024-01-01,['Mo Eun-sol'],['\\N'],tt33040785,https://m.media-amazon.com/images/M/MV5BNTBkNDkwMjctOTc5ZC00MDUxLWJjYjctMDJkM2MzZDA5OWZmXkEyXkFqcGc@
250,Sell Your Haunted House,7.6,"Comedy,Fantasy,Horror",1700,"Ji Ah, who has a tragic past, runs a realty business in which she exorcises evil spirits from properties. When she meets a conman In Beom with special psychic powers who may be able to help her understand her past, the two join forces.",Jang Na-ra,Jung Yong-hwa,2021-01-01,2021-01-01,"['Ha Soo-jin', 'Jung Yeon-Seo', 'Lee Young-Hwa']",['Park Jin-seok'],tt14223310,https://m.media-amazon.com/images/M/MV5BNzYyMWI2ZTktNDM3YS00ZTFhLThkNzEtNDFhM2M0OWJjMWI5XkEyXkFqcGc@
251,Celebrity,7.4,"Drama,Mystery,Thriller",7400,Fame. Money. Power. One young woman fights to become the next hottest celebrity in the glamorous yet scandalous world of influencers in Seoul.,Park Gyuyoung,Kang Min-hyuk,2023-01-01,2023-01-01,['Yi Young Kim'],['Kim Cheol-gyu'],tt26315488,https://m.media-amazon.com/images/M/MV5BYzQ4ZmUyNzItNWVlNy00MzlmLWI5OTItODkyODIwZGYwOThmXkEyXkFqcGc@
252,Alien Stage,8.5,"Animation,Music,Sci-Fi",242,Aliens run a brutal singing contest for abducted humans in their post-apocalyptic world. Season 50 promises the same drama and thrills. Contestants must perform well or face elimination.,Rubyeye,BL8M,2022-01-01,2022-01-01,['\\N'],"['Qmeng', 'Vivinos', 'nm17625648', 'Callnong']",tt36378945,https://m.media-amazon.com/images/M/MV5BNjU2NWFlYWUtNmViYi00ZWVmLTk0ZGYtMGNmMDQwYmQzNDQzXkEyXkFqcGc@
254,Anna,7.0,Drama,2100,Woman's petty lie spins her life in an entirely unforeseen direction. She finds herself living someone else's life in this unpredictable tale.,Bae Suzy,Bae Suzy,2022-01-01,2022-01-01,['Lee Joo-young'],['Lee Joo-young'],tt21146902,https://m.media-amazon.com/images/M/MV5BMTQ5ZmZjYjktY2ZmZi00ZTVhLTk0NTctZTJhNGNkNTg0MjY3XkEyXkFqcGc@
256,"Hello, Me!",7.2,"Comedy,Drama,Fantasy",1200,"Miserable and unsuccessful, a woman thinks she's lost all her spark, until one day, her spunky younger self appears in front of her demanding change.",Choi Kang-hee,Kim Young-kwang,2021-01-01,2021-01-01,"['Kim Hye-Jung', 'Yoo Song-yi']",['Lee Hyeon-Suk'],tt13670090,https://m.media-amazon.com/images/M/MV5BNTczZjcxOGMtYzg2Ny00MDNhLThkNjktYTA3ZTg4OTgyYjM2XkEyXkFqcGc@
261,Love Song for Illusion,7.1,"Drama,Fantasy,History",594,"A fantasy historical drama romance that crosses between a man with two opposite personalities and a woman who loves him, fresh love and fierce obsession.",Park Ji-hoon,Park Ji-hoon,2024-01-01,2024-01-01,['\\N'],['Lee Jung-seob'],tt30133601,https://m.media-amazon.com/images/M/MV5BOGM3N2E3MTgtZjJiMC00ZDdlLTkzZTAtYWI2OGRjMjAyMDY1XkEyXkFqcGc@
262,The Killer's Shopping List,7.1,"Comedy,Mystery,Thriller",494,"One day, a dead body is found at an apartment near the supermarket. Finding this murder odd, Dae-sung, his mother, and his girlfriend Ah-hee gather around to find the real murderer, starting by looking through the receipts of the market.",Lee Kwang-soo,Kim Seol-hyun,2022-01-01,2022-01-01,['Ji Wan Han'],['Lee Eon-hie'],tt20192566,https://m.media-amazon.com/images/M/MV5BODY5YzdlODQtYjkzNi00MzcxLThlZTgtMTI0ODVlODJhNmY2XkEyXkFqcGc@
263,The Eighth Sense: The Series,8.7,"Drama,Romance",1900,"An enigmatic senior crosses paths with a lost freshman. As their relationship blooms, they're forced to confront their inner demons and embark on a journey of self-discovery.",Jun-Taek Oh,Jun-Taek Oh,2023-01-01,2023-01-01,"['Inu Baek', 'Werner du Plessis']","['Inu Baek', 'Werner du Plessis']",tt27300087,https://m.media-amazon.com/images/M/MV5BNTY2MWZkZjQtOWU4MS00Yjc4LWE5MGEtZDlkMmQyMDM3NmYyXkEyXkFqcGc@
265,Hunter with a Scalpel,6.9,"Crime,Drama,Mystery",567,"Se-hyun, a genius forensic scientist who discovers traces of her father's killings while doing an autopsy, and goes on a hunt in order to hide the past that she wants to erase, before the police get to the truth first.",Park Ju-hyun,Park Yong-woo,2025-01-01,2025-01-01,['\\N'],"['nm17779801', 'Lee Jung Hoon']",tt36807941,https://m.media-amazon.com/images/M/MV5BNGQxYmMyYmMtOTUxMS00NmNkLWE3MGUtYzc2OTZkYzJhZGZlXkEyXkFqcGc@
268,Family Plan,8.0,"Action,Crime,Drama",1300,A story about a group of people with special abilities who disguise themselves as family members to survive and use unique methods to overcome the vicious criminals who threaten them.,Bae Doona,Ryu Seung-beom,2024-01-01,2024-01-01,['Jung-min Kim'],['Gok Kim'],tt31510539,https://m.media-amazon.com/images/M/MV5BNWM0ODkzNDgtYzMzMy00MGI4LTk0NjItODg5YWYwYWFhMTVmXkEyXkFqcGc@
270,The Atypical Family,7.6,"Drama,Fantasy,Romance",4400,"Bok Gwi Joo's family has supernatural abilities. He can revisit happy past moments. Depression causes him to lose this power. His family also loses abilities due to modern issues. Do Da He joins their household, instigating change.",Jang Ki-yong,Chun Woo-hee,2024-01-01,2024-01-01,['\\N'],['\\N'],tt32166552,https://m.media-amazon.com/images/M/MV5BZDE5Njc0ODYtYWRhYS00NjVlLTg2MWQtZWY5YTRmYjJlNjNiXkEyXkFqcGc@
272,Doctor Cha Jeong Suk,7.5,Drama,2700,"It tells the story of a medical graduate turned housewife but decided to return to the medical field, and a doctor husband who maintains a perfect dual life. He is great at his job and he is also great at cheating on his wife.",Kim Mi-kyung,Uhm Junghwa,2023-01-01,2023-01-01,['\\N'],['Dae-jin Kim'],tt27075857,https://m.media-amazon.com/images/M/MV5BOTc0MDUxMmMtNmU5ZS00OWRmLTljZDUtM2FiZDIxM2RmNjYzXkEyXkFqcGc@
275,Rookie Cops,7.5,"Drama,Romance",1500,"A story that captures the challenges, spirit and passion of youth as two students at the Korean National Police University study to become cops.",Daniel Kang,Daniel Kang,2022-01-01,2022-01-01,['Ha-na Lee'],['Byung-Soo Kim'],tt17473062,https://m.media-amazon.com/images/M/MV5BOTRkNDhjOGItMjEzYy00NTVmLWIyZjgtNWU1M2VmMWY2Y2YyXkEyXkFqcGc@
276,The Golden Spoon,7.5,"Drama,Fantasy,Mystery",1800,Seung Cheon gets his hands on a magical spoon that allows him to switch lives with his rich best friend. Now he has to decide which of his two possible futures is worth keeping.,Yook Sung-jae,Lee Jong-Won,2022-01-01,2022-01-01,"['Kim Seonsu', 'Eun-kyeong Yun']",['Hyun Wook Song'],tt22248234,https://m.media-amazon.com/images/M/MV5BZWY4NzA2MGYtYzFkZC00M2IwLWJhZWMtODllYjZlYmQxNGNkXkEyXkFqcGc@
284,Ghost Doctor,7.9,"Comedy,Fantasy,Romance",3200,"Cha Young Min is a genius doctor but arrogant and selfish. One day, he gets involved in an unexpected case; his spirit possesses another doctor's body. These two doctors are complete opposites, with personalities and medical abilities.",Rain,Kim Bum,2022-01-01,2022-01-01,['Kim Seonsu'],['Bu Seongcheol'],tt16493854,https://m.media-amazon.com/images/M/MV5BMzE3MmNhNzgtNjZjNi00MDAwLThkNzMtMDcwNTQ2NmYzYTQxXkEyXkFqcGc@
285,Connect,6.5,"Crime,Drama,Fantasy",2500,A man is kidnapped and one of his is eyes removed by a gang of organs hunters and transplanted into a serial killer. The unwilling donor now has terrible visions as he witnesses terrifying attacks on the residents of Seoul.,Jung Hae-in,Go Kyung-pyo,2022-01-01,2022-01-01,"['Elliot Schiff', 'Heo-dam', 'Masaru Nakamura']",['Takashi Miike'],tt22002370,https://m.media-amazon.com/images/M/MV5BNTlkZTVmNzYtMTUyOC00YWI5LTk0OTctYjBjZTgyNGMzY2NiXkEyXkFqcGc@
287,Summer Strike,7.8,"Drama,Romance",3400,"Adapted from a webtoon. A drama about voluntary unemployed Lee Yeo-reum and librarian Ahn Dae-beom, who declared a life strike, leaving a complex city and looking for themselves in a strange place.",Yim Si-wan,Kim Seol-hyun,2022-01-01,2022-01-01,['\\N'],['Yoon Jeong Lee'],tt23788642,https://m.media-amazon.com/images/M/MV5BODU1YTE3N2EtOThkZS00OTQ4LTlhMTMtMWVkZWMxNTUxOWUwXkEyXkFqcGc@
288,Mask Girl,7.3,"Comedy,Drama,Horror",10000,An office worker who is insecure about her looks becomes a masked internet personality by night until a chain of ill-fated events overtakes her life.,Ren Hanami,Elaine Wang,2023-01-01,2023-01-01,"['Mae Mi', 'Kim Yong-hoon']",['Kim Yong-hoon'],tt26258200,https://m.media-amazon.com/images/M/MV5BYjM2MGMyMDItZGVmOC00Yzk3LTk0MmYtN2IxNTExMmYyNWZjXkEyXkFqcGc@
289,She Would Never Know,7.4,"Drama,Romance",2700,"Based on a popular 2017 Web Novel of the same name, it tells the love story between a lovely ""sunbae"" and a bold ""hoobae"".",Won Jin-ah,Kim Ro-Woon,2021-01-01,2021-01-01,['Chae Yoon'],['Lee Dong-yoon'],tt13446244,https://m.media-amazon.com/images/M/MV5BZTVkNTA5N2MtYTBmNC00N2MwLWJkNjEtZjJiM2FkZGU2NDMxXkEyXkFqcGc@
291,The Forbidden Marriage,7.5,"Comedy,Drama,History",1100,"Ye So-rang, a fraudulent match-maker insisting she can summon the deceased crown princess, shows up to King Lee Heon who proclaimed a ban on marriage since he lost his wife 7 years ago.",Park Ju-hyun,Park Ju-hyun,2022-01-01,2022-01-01,['Cheon Ji-hye'],"['Jung Hoon', 'Park Sang Woo']",tt24224784,https://m.media-amazon.com/images/M/MV5BZjYyM2RjOGMtYzk3MC00OTRhLWI5NjQtOWQ1M2U4ZDkyMmVkXkEyXkFqcGc@
292,Once Upon a Small Town,7.1,"Comedy,Drama,Romance",2500,"A city veterinarian moves to the countryside where he meets a policewoman, a town insider with a friendly secret.",Park Soo-young,Choo Young-woo,2022-01-01,2022-01-01,['Baek Eun-kyeong'],['Kwon Seok-jang'],tt21875462,https://m.media-amazon.com/images/M/MV5BYWYyOGQ3MTktZGRlOC00NGNkLWI3M2EtMmQ1YzA5MWYyNGQzXkEyXkFqcGc@
294,Such a Close Traitor,7.6,"Action,Mystery,Thriller",1000,A family psychological thriller about a dilemma that Korea's best profiler experiences when he learns the secret of his daughter related to the murder crime he is investigating.,Han Suk-kyu,Chae Won-Bin,2024-01-01,2024-01-01,['\\N'],['Yeon-hwa Soon'],tt30324574,https://m.media-amazon.com/images/M/MV5BY2M1M2EwMGMtN2EzOC00ZjM1LTg0ODgtNjFjNWI3YWJhNDg1XkEyXkFqcGc@
297,The Bequeathed,6.4,"Crime,Drama,Mystery",2400,"A story in which ominous things continue and the secrets of the family are revealed as they suddenly inherit the family mountain from their uncle, whom they had forgotten.",Kim Hyun-joo,Park Byeong-eun,2024-01-01,2024-01-01,"['Hwang Eun-young', 'Min Hong-nam', 'Yeon Sang-ho', 'nm17675462']",['Min Hong-nam'],tt28225048,https://m.media-amazon.com/images/M/MV5BNWY2NDBhYTUtZTI3ZS00Zjg4LTlhM2UtZDI1M2Q1NWJkYTM2XkEyXkFqcGc@
301,Love Scout,7.7,"Comedy,Drama,Romance",2700,"Yoo Eun-ho, a single dad armed with perfection, becomes the secretary of Kang Ji-yun, the CEO of a popular headhunter company, who doesn't do anything except work.",Han Ji-min,Lee Jun-hyuk,2025-01-01,2025-01-01,['Kim Ji-Eun'],['Ham Joon-ho'],tt34730468,https://m.media-amazon.com/images/M/MV5BNzNlMzhhMjktM2RlNS00NzRjLTgwYmEtNzZkZmJmNGIxMzNkXkEyXkFqcGc@
302,Gaus Electronics,7.8,Comedy,1000,"Marketing team members at Gaus Electronics multinational navigate corporate politics, interpersonal dynamics and life events while maintaining camaraderie.",Kwak Dong-yeon,Bae Hyun-Sung,2022-01-01,2022-01-01,"['Gwak Baek-soo', 'Kang Go-eun']",['Park Jun-soo'],tt22873700,https://m.media-amazon.com/images/M/MV5BZjIyNjI2ODYtMDRlYS00ZmZkLTlmZGEtNjBlYThjNDRiZjFlXkEyXkFqcGc@
305,Tarot,5.2,"Drama,Horror",315,"Seven spooky tales centered on a cursed tarot deck, each story following those afflicted by its malevolent power as the cards change hands, unleashing supernatural terrors upon the unsuspecting owners.",Kim Jin-young,Cho Yeo-jeong,2024-01-01,2024-01-01,['Kyung Min-sun'],['Choi Byeong-gil'],tt31721651,https://m.media-amazon.com/images/M/MV5BMjU2MmZmMzMtMzU0NS00OTZiLWJkMTYtYmZkMjI2Yzk1NDQwXkEyXkFqcGc@
308,No Gain No Love,7.5,"Comedy,Drama,Romance",3700,"Follows a woman who embarks on a journey of self-discovery and personal growth, navigating the complexities of life and relationships while pursuing her dreams.",Shin Min-a,Shin Min-a,2024-01-01,2024-01-01,['Hye Young Kim'],"['Jessica Blue', 'Kim Jung-Shik']",tt32981987,https://m.media-amazon.com/images/M/MV5BZjYwZjVjODUtNjcwNS00NjJmLWE1ODItZTRhOTU3Y2YwMGE0XkEyXkFqcGc@
309,Adult Trainee,6.7,"Comedy,Romance",644,Three different coming-of-age stories from the point of view of the protagonists about how they deal with their realities in high school at the end of their teenage period as Gen Z.,Ryu Eui-Hyun,Jo Yoo-jung,2021-01-01,2021-01-01,['\\N'],['\\N'],tt16383322,https://m.media-amazon.com/images/M/MV5BMzVhMTVjZDMtMWVlYS00MzY1LWJiNjctOTdkNjlhNjBlZjU1XkEyXkFqcGc@
311,Once Upon a Boyhood,7.9,"Comedy,Thriller",857,"Byung Tae, a socially awkward teen bullied for most of his life, transfers to the countryside, hoping for a fresh start. Yet high jinks ensue when he is mistaken for the best fighter in school and must maintain the facade.",Yim Si-wan,Lee Sun-bin,2023-01-01,2023-01-01,['\\N'],['Myoungwoo Lee'],tt28486727,https://m.media-amazon.com/images/M/MV5BYmI1ZjRiZDktNDBlZi00ZmI4LTgwM2EtYjk2OWNkYWUxZTJmXkEyXkFqcGc@
314,To My Star,8.0,"Drama,Romance,Short",3000,"After his career takes a turn for the worse, superstar actor Kang Seo Joon is afraid he's hit rock bottom. But after a chance meeting brings the talented chef Han Ji Woo into his life, Seo Joon is certain his luck is about to change.",Son Woo-Hyun,Kim Kang-min,2021-01-01,2021-01-01,['\\N'],['Hwang Da-Seul'],tt13788764,https://m.media-amazon.com/images/M/MV5BNzIxNDQxMjAtZGYyYS00MDliLWE5MDYtNGVjZmU4ODEyZjkxXkEyXkFqcGc@
315,The Queen Who Crowns,7.6,"Drama,History,Romance",267,"Queen Wongyeong from a powerful family marries Yi Bang-Won, helping him become King Taejong. But their relationship deteriorates when he takes concubines and diminishes her influence.",Cha Joo-young,Lee Hyun-wook,2025-01-01,2025-01-01,['Lee Young-mi'],['Kim Sang-ho'],tt35305917,https://m.media-amazon.com/images/M/MV5BMWEwOTFmNjQtN2RkZS00ODcxLThhMzktNDBlYjYzMjI1NmQ5XkEyXkFqcGc@
316,Hyper Knife,7.3,"Crime,Drama,Thriller",2000,"A disgraced neurosurgeon performs illegal surgeries while confronting her dark past. When she meets her former mentor, a battle of power and revenge unfolds as she pushes ethical boundaries in pursuit of medical breakthroughs.",Park Eun-bin,Sul Kyung-gu,2025-01-01,2025-01-01,['Kim Sun Hee'],['Kim Jung-hyun'],tt35378081,https://m.media-amazon.com/images/M/MV5BYThkZjZlMDktOWVmMy00NTlhLWE4ZjgtNTM2OWNmN2YwMmIyXkEyXkFqcGc@
317,The Secret Romantic Guesthouse,7.4,"Drama,History,Romance",558,"A work about an incident that takes place when the owners of the boarding house called 'Guest Summer Palace', which breaks stereotypes, and boarders with secrets gather to find Lee Seol who disappeared 13 years ago.",Shin Ye-eun,Ryeoun,2023-01-01,2023-01-01,['Eum-mi Kwon'],['Kim Jung Min'],tt26600066,https://m.media-amazon.com/images/M/MV5BNzY1NTMyZmEtYThlMS00MDQ0LTkyM2EtODA5N2Q0MTZhYjMxXkEyXkFqcGc@
318,"At A Distance, Spring Is Green",7.8,"Drama,Romance",1600,A coming of age campus story about youth in their 20s whose lives appear to be like the beauty of spring from afar but cold and harsh when viewed up close.,Park Ji-hoon,Kang Min-ah,2021-01-01,2021-01-01,"['Ji Nyoong', 'Jung Won-Jung']",['Kim Jung-hyun'],tt14518430,https://m.media-amazon.com/images/M/MV5BYjg3ZDMxOGMtMGEyZS00NDdjLTljMTItOTliY2UwN2IzMTJlXkEyXkFqcGc@
319,Adamas,7.0,"Drama,Mystery,Thriller",1100,A story of twin brothers uncovering the truth from an incident 22 years ago.,Ji Sung,Ji Sung,2022-01-01,2022-01-01,"['Franciska Friede', 'Tae-Kang Choi']",['Park Seung-Woo'],tt21195588,https://m.media-amazon.com/images/M/MV5BMzQ5OGM2MTctYjA5ZS00ZWNhLWIzODgtZGU4MjhmZmQ1MDMwXkEyXkFqcGc@
322,Imitation,7.3,"Comedy,Music,Romance",1200,"Based on the webtoon of the same name, it tells the story of the lives of idols in the entertainment industry, centered around the secret romance between a member of a rookie girl group and a member of the top boy group in the industry.",Jung Ji-so,Lee Jun-young,2021-01-01,2021-01-01,"['Min-Jung Kim', 'Park Kyung-Ran', 'Choi Sun-Young']",['Hyun-Hee Han'],tt14371376,https://m.media-amazon.com/images/M/MV5BNTE5YTMxN2MtNzRkNC00OTQ1LWI4YWItNzlmNDlmYWZlOWRhXkEyXkFqcGc@
324,"Work Later, Drink Now",7.7,"Comedy,Drama",698,The story of three women whose belief in life is one drink at the end of the day.,Lee Sun-bin,Jung Eun-ji,2021-01-01,2021-01-01,"['Mikkang', 'Wi So-Young']",['Kim Jung-Shik'],tt15548198,https://m.media-amazon.com/images/M/MV5BNzY5ZTU4YmYtYzc2Ni00ZmVhLTg0YzctYzFiNDZhY2FlNzJkXkEyXkFqcGc@
325,Second Shot at Love,6.8,"Comedy,Drama,Romance",539,"A woman in denial about her drinking problem encounters her former best friend from high school, now cold and unsympathetic. His changed attitude pushes her to investigate what altered him.",Sooyoung Choi,Gong Myoung,2025-01-01,2025-01-01,"['nm17729812', 'Soo-Hyun Myung']","['Nam Hyeong Jo', 'You-Jeong Jang']",tt36802356,https://m.media-amazon.com/images/M/MV5BMzgyMzhhZWMtYWVjNy00NzM1LTlkYTAtZjAxZjljZWZiYTI0XkEyXkFqcGc@
327,Branding in Seongsu,6.5,"Romance,Thriller",485,"After an accidental kiss causes a body swap, two ideologically opposed people struggle to navigate each other's lives.",Kim Ji-eun,Park Solomon,2024-01-01,2024-01-01,['Sun-Mi Choi'],['\\N'],tt30333603,https://m.media-amazon.com/images/M/MV5BOWIxMGI0M2QtNzFiOC00OGMzLTlhZDEtN2Y1MzFlOWMzNDQwXkEyXkFqcGc@
328,Under the Queen's Umbrella,8.4,"Comedy,Drama",3600,"Im Hwa Ryeong, a prickly, sensitive and hot-tempered queen, tries to turn her trouble making princes into proper crown princes.",Kim Hye-su,Moon Sang-min,2022-01-01,2022-01-01,['\\N'],['Kim Hyeong-sik'],tt22265394,https://m.media-amazon.com/images/M/MV5BZGI2NDBmY2UtMGM1My00ZThjLTljOTktZjA5ZmQ3ODNmNDM2XkEyXkFqcGc@
329,Chief Detective 1958,7.8,"Crime,Drama,Mystery",1100,Park Young-Han (Lee Je-Hoon) is a young detective. He becomes furious at the reality of human dignity being violated and he struggles to deal with it. He teams up with his colleague detectives,Lee Je-hoon,Lee Dong-hwi,2024-01-01,2024-01-01,['Kim Young-Shin'],['Kim Sung-hoon'],tt30485422,https://m.media-amazon.com/images/M/MV5BZTM4MzhhYjctMWE5Ni00YmMwLWI5YzAtMzdiZTVkMTdmYmMxXkEyXkFqcGc@
332,The Tyrant,6.7,"Action,Drama,Sci-Fi",1400,The story of people who gather to occupy samples for different purposes after the last sample of the so-called 'Tyrant Program' disappears in a delivery accident.,Jo Yoon-soo,Jo Yoon-soo,2024-01-01,2024-01-01,['Park Hoon-jung'],['Park Hoon-jung'],tt26009468,https://m.media-amazon.com/images/M/MV5BNWFlZDVlZTYtYzg3OC00Y2ZiLTgxOWItZjBhMjQyZjdjMzMzXkEyXkFqcGc@
333,Crushology 101,6.6,"Comedy,Romance",501,"Bunny, a top sculpture student, struggles with self-esteem after a failed relationship. Her life changes when she meets Hwang Jae Yul, a warm design student, and Cha Ji Won, a perfect chaebol heir.",Roh Jeong-eui,Lee Chae-Min,2025-01-01,2025-01-01,"['Sung So Eun', 'Lee Seul']",['\\N'],tt36509275,https://m.media-amazon.com/images/M/MV5BNTJlMTkzNjUtN2Y0MC00MTZlLWE4MmUtNjJkYzlhMTdmMDUyXkEyXkFqcGc@
334,The Real Deal Has Come!,6.4,"Drama,Romance",533,"Family drama begins to center around an unmarried pregnant woman and an unmarried man who enter into a false contract which leads to them to romance, pregnancy, childbirth, and childrearing.",Baek Jin-hee,Ahn Jae-Hyun,2023-01-01,2023-01-01,['\\N'],['Jun-seo Han'],tt26684155,https://m.media-amazon.com/images/M/MV5BYWNlNjkyMzQtOTQxOC00MjIwLTkwZGItZTZjOGY5ODEwYjYwXkEyXkFqcGc@
336,House of Lies,6.7,"Crime,Mystery,Thriller",144,"Ji-Na works as a contract employee, and appears to live a normal life. One day, she hears that her older sister Ji-Hyun is missing. Ji-Na goes to Rose Mansion Apartment, where unexpected events unfolds.",Lim Ji-yeon,Yoon Kyun-sang,2022-01-01,2022-01-01,['Kab-yeol Yu'],['Hong-Seung Yoon'],tt21603486,https://m.media-amazon.com/images/M/MV5BOWJmYTUxZTUtZWNjNS00MjU1LWI3NzMtMWMwMjkyNTU3ZWU4XkEyXkFqcGc@
337,Low Life,6.7,"Adventure,Crime,Drama",318,A fisherman as he discovers a treasure lost for generations at the bottom of the ocean. Taking a small part of it home for himself.,Rich Ting,Yang Se-jong,2025-01-01,2025-01-01,['Yunsung Kang'],['Yunsung Kang'],tt32122656,https://m.media-amazon.com/images/M/MV5BZDMyZmRmNjUtNTQ0Ni00MTYxLTk3YzItZjNhZTNlMzUxNjlhXkEyXkFqcGc@
339,Captivating the King,7.6,"Drama,History,Romance",1900,"A work that deals with the cruel love story of King Yi In, who is in a political crisis, fighting for the throne, and Kang Hee-soo, a secret agent who approaches Yi In for revenge but ends up being enchanted.",Jo Jung-suk,Shin Sae-Kyeong,2024-01-01,2024-01-01,['Kim Seondeok'],['Nam-kook Jo'],tt29833806,https://m.media-amazon.com/images/M/MV5BNzFhOGVkMTUtMzVhMS00OTA1LWIyYzktNzdkMzM1NThhY2RhXkEyXkFqcGc@
